"AIRPORT","TR_AIRPORT_NAME","TR_CITY_NAME","TR_STATE_NAME",
"CGC","Cape Gloucester, Papua New Guinea: Cape Gloucester Airport","Cape Gloucester, Papua New Guinea","",
"CPN","Cape Rodney, Papua New Guinea: Cape Rodney Airport","Cape Rodney, Papua New Guinea","",
"CVL","Cape Vogel, Papua New Guinea: Cape Vogel Airport","Cape Vogel, Papua New Guinea","",
"DAU","Daru, Papua New Guinea: Daru Airport","Daru, Papua New Guinea","",
"DAF","Daup, Papua New Guinea: Daup Airport","Daup, Papua New Guinea","",
"ESA","Esa'ala, Papua New Guinea: Esa Ala","Esa'ala, Papua New Guinea","",
"FIN","Finschhafen, Papua New Guinea: Finschhafen Airport","Finschhafen, Papua New Guinea","",
"GKA","Goroka, Papua New Guinea: Goroka Airport","Goroka, Papua New Guinea","",
"GUR","Gurney, Papua New Guinea: Gurney Airport","Gurney, Papua New Guinea","",
"HKN","Hoskins, Papua New Guinea: Hoskins Airport","Hoskins, Papua New Guinea","",
"AGK","Kagua, Papua New Guinea: Kagua Airport","Kagua, Papua New Guinea","",
"KVG","Kavieng, Papua New Guinea: Kavieng Airport","Kavieng, Papua New Guinea","",
"KMA","Kerema, Papua New Guinea: Kerema Airport","Kerema, Papua New Guinea","",
"UNG","Kiunga, Papua New Guinea: Kiunga Airport","Kiunga, Papua New Guinea","",
"KOD","Koroba, Papua New Guinea: Koroba Airport","Koroba, Papua New Guinea","",
"KSP","Kosipe, Papua New Guinea: Kosipe Airport","Kosipe, Papua New Guinea","",
"LAE","Lae, Papua New Guinea: Nadzab","Lae, Papua New Guinea","",
"MAG","Madang, Papua New Guinea: Madang Airport","Madang, Papua New Guinea","",
"MLQ","Malalaua, Papua New Guinea: Malalaua Airport","Malalaua, Papua New Guinea","",
"MAP","Mamai, Papua New Guinea: Mamai Airport","Mamai, Papua New Guinea","",
"MDU","Mendi, Papua New Guinea: Mendi Airport","Mendi, Papua New Guinea","",
"MZN","Minj, Papua New Guinea: Minj Airport","Minj, Papua New Guinea","",
"MIS","Misima Island, Papua New Guinea: Misima","Misima Island, Papua New Guinea","",
"MPX","Miyanmin, Papua New Guinea: Miyanmin Airport","Miyanmin, Papua New Guinea","",
"MXH","Moro, Papua New Guinea: Moro Airport","Moro, Papua New Guinea","",
"HGU","Mount Hagen, Papua New Guinea: Mount Hagen Airport","Mount Hagen, Papua New Guinea","",
"NUG","Nuguria, Papua New Guinea: Nuguria Airport","Nuguria, Papua New Guinea","",
"PNG","Popondetta, Papua New Guinea: Popondetta Airport","Popondetta, Papua New Guinea","",
"PNP","Popondetta, Papua New Guinea: Girua","Popondetta, Papua New Guinea","",
"POM","Port Moresby, Papua New Guinea: Port Moresby Airport","Port Moresby, Papua New Guinea","",
"RAB","Rabaul, Papua New Guinea: Rabaul Airport","Rabaul, Papua New Guinea","",
"SGJ","Sagarai, Papua New Guinea: Sagarai Airport","Sagarai, Papua New Guinea","",
"SAM","Salamo, Papua New Guinea: Salamo Airport","Salamo, Papua New Guinea","",
"SBC","Selbang, Papua New Guinea: Selbang Airport","Selbang, Papua New Guinea","",
"SGB","Singaua, Papua New Guinea: Singaua Airport","Singaua, Papua New Guinea","",
"SKC","Suki, Papua New Guinea: Suki Airport","Suki, Papua New Guinea","",
"TUT","Tauta, Papua New Guinea: Tauta Airport","Tauta, Papua New Guinea","",
"WAB","Wabag, Papua New Guinea: Wabag Airport","Wabag, Papua New Guinea","",
"AGL","Wanigela, Papua New Guinea: Wanigela Airport","Wanigela, Papua New Guinea","",
"WBM","Wapenamanda, Papua New Guinea: Wapenamanda Airport","Wapenamanda, Papua New Guinea","",
"WWK","Wewak, Papua New Guinea: Wewak Airport","Wewak, Papua New Guinea","",
"LAC","City, Papua New Guinea: City","City Airport, Papua New Guinea","",
"LAE","Nadzab, Papua New Guinea: Nadzab","Nadzab Airport, Papua New Guinea","",
"AUP","Aguan, Papua New Guinea: Aguan Papua N.G.","Aguan, Papua New Guinea","",
"GUR","Alotau, Papua New Guinea: Gurney","Alotau, Papua New Guinea","",
"AMF","Ama, Papua New Guinea: Ama Papua N.G.","Ama, Papua New Guinea","",
"AGG","Angoram, Papua New Guinea: Angoram","Angoram, Papua New Guinea","",
"MSE","Manston, United Kingdom: Manston Airport","Manston, United Kingdom","",
"MHZ","Mildenhall, United Kingdom: Mildenhall Airport","Mildenhall, United Kingdom","",
"GHX","Mildenhall, United Kingdom: Mildenhall Navy Air Field","Mildenhall, United Kingdom","",
"GXH","Mildenhall, United Kingdom: Mildenhall Navy Air Field","Mildenhall, United Kingdom","",
"NCL","Newcastle-Upon-Tyne, United Kingdom: Newcastle/Woolsington","Newcastle-Upon-Tyne, United Kingdom","",
"NQY","Newquay, United Kingdom: St Mawgan","Newquay, United Kingdom","",
"PZE","Penzance, United Kingdom: Penzance Airport","Penzance, United Kingdom","",
"ISC","Scilly Isles, United Kingdom: Scilly Islands/St Marys","Scilly Isles, United Kingdom","",
"ZXE","Sculthorpe, United Kingdom: Sculthorpe Airport","Sculthorpe, United Kingdom","",
"SZD","Sheffield, United Kingdom: Sheffield City","Sheffield, United Kingdom","",
"SOU","Southampton, United Kingdom: Eastleigh","Southampton, United Kingdom","",
"SEN","Southend-On-Sea, United Kingdom: Southend","Southend-On-Sea, United Kingdom","",
"SYY","Stornoway, United Kingdom: Stornoway Airport","Stornoway, United Kingdom","",
"SWI","Swindon, United Kingdom: Swindon Airport","Swindon, United Kingdom","",
"MME","Tees-Side, United Kingdom: Tees Side","Tees-Side, United Kingdom","",
"UNT","Unst, United Kingdom: Unst Airport","Unst, United Kingdom","",
"UHF","Upper Heyford, United Kingdom: Upper Heyford Airport","Upper Heyford, United Kingdom","",
"WIC","Wick, United Kingdom: Wick Airport","Wick, United Kingdom","",
"YEO","Yeovilton, United Kingdom: Yeovilton Airport","Yeovilton, United Kingdom","",
"BHD","Belfast, United Kingdom: Belfast City","Belfast, United Kingdom","",
"GLA","Abbotsinch, United Kingdom: Abbotsinch Glascow","Abbotsinch Airport, United Kingdom","",
"GLA","Glasgow, United Kingdom: Glasgow","Glasgow Airport, United Kingdom","",
"/BL","Belfast, United Kingdom: Belfast Airport","Belfast, United Kingdom","",
"EVS","East Midland, United Kingdom: East Midland","East Midland, United Kingdom","",
"/GL","Glasgow/Prestwick, United Kingdom: /Gl Glasgow/Prestwick","Glasgow/Prestwick, United Kingdom","",
"GLO","Gloucester/Cheltenham, United Kingdom: Gloucester","Gloucester/Cheltenham, United Kingdom","",
"XXA","Hatfield, United Kingdom: Hatfield Airport","Hatfield, United Kingdom","",
"HTF","Hatfield, United Kingdom: Hatfield Airport","Hatfield, United Kingdom","",
"HUY","Humberside, United Kingdom: Humberside Airport","Humberside, United Kingdom","",
"SKL","Isle Of Skye, United Kingdom: Isle Of Skye Airport","Isle Of Skye, United Kingdom","",
"XLK","Lakenheath, United Kingdom: Lakenheath Airport","Lakenheath, United Kingdom","",
"/LO","London, United Kingdom: Farnborough","London, United Kingdom","",
"/LO","London, United Kingdom: (London Mean)","London, United Kingdom","",
"LTN","Luton, United Kingdom: Luton Airport","Luton, United Kingdom","",
"LTN","Luton, United Kingdom: Luton Airport","Luton, United Kingdom","",
"/MJ","Mildenhall, United Kingdom: (Mildenhall Mean)","Mildenhall, United Kingdom","",
"STN","Stansted, United Kingdom: Stansted Airport","Stansted, United Kingdom","",
"NCL","Newcastle, United Kingdom: Newcastle Airport","Newcastle, United Kingdom","",
"NRL","North Ronaldsay, United Kingdom: No. Ronaldsay Scot.","North Ronaldsay, United Kingdom","",
"NWI","Norwich, United Kingdom: Norwich Airport","Norwich, United Kingdom","",
"PLH","Plymouth, United Kingdom: Plymouth Airport","Plymouth, United Kingdom","",
"WOV","Skye Island, United Kingdom: Isle Of Skye","Skye Island, United Kingdom","",
"TRE","Tiree Island, United Kingdom: Tiree Island","Tiree Island, United Kingdom","",
"BWY","Woodbridge, United Kingdom: Bentwaters","Woodbridge, United Kingdom","",
"XXB","Woodford, United Kingdom: Woodford Airport","Woodford, United Kingdom","",
"FZO","Filton, United Kingdom: Bristol/Filton","Filton, United Kingdom","",
"BEG","Belgrade, Serbia and Montenegro: Belgrade International","Belgrade, Serbia and Montenegro","",
"DBV","Dubrovnik, Yugoslavia: Dubrovnik Airport","Dubrovnik, Yugoslavia","",
"LJU","Ljubljana, Yugoslavia: Ljubljana International","Ljubljana, Yugoslavia","",
"OMO","Mostar, Yugoslavia: Mostar Airport","Mostar, Yugoslavia","",
"OHD","Ohrid, Yugoslavia: Ohrid Airport","Ohrid, Yugoslavia","",
"PRN","Pristina, Yugoslavia: Pristina International","Pristina, Yugoslavia","",
"PUY","Pula, Yugoslavia: Pula Airport","Pula, Yugoslavia","",
"RJK","Rijeka, Yugoslavia: Rijeka/Krk","Rijeka, Yugoslavia","",
"SJJ","Sarajevo, Yugoslavia: Sarajevo/Butmir","Sarajevo, Yugoslavia","",
"ASA","Assab, Ethiopia: Assab Airport","Assab, Ethiopia","",
"BJR","Bahar Dar, Ethiopia: Bahar Dar Airport","Bahar Dar, Ethiopia","",
"BCY","Bulchi, Ethiopia: Bulchi Airport","Bulchi, Ethiopia","",
"DBM","Debra Marcos, Ethiopia: Debre Marcos","Debra Marcos, Ethiopia","",
"DBT","Debra Tabor, Ethiopia: Debre Tabor","Debra Tabor, Ethiopia","",
"DEM","Dembidollo, Ethiopia: Dembidollo Airport","Dembidollo, Ethiopia","",
"DSE","Dessie, Ethiopia: Dessie/Combolcha","Dessie, Ethiopia","",
"DIR","Dire Dawa, Ethiopia: Aba Tenna Dejazmatch Yilma","Dire Dawa, Ethiopia","",
"GOB","Goba, Ethiopia: Goba Airport","Goba, Ethiopia","",
"GDQ","Gondar, Ethiopia: Gondar Airport","Gondar, Ethiopia","",
"GOR","Gore, Ethiopia: Gore Airport","Gore, Ethiopia","",
"HUE","Humera, Ethiopia: Humera Airport","Humera, Ethiopia","",
"SHC","Indaselassie, Ethiopia: Shire","Indaselassie, Ethiopia","",
"JIM","Jimma, Ethiopia: Aba Segud Negus Wolde Giorg","Jimma, Ethiopia","",
"LLI","Lalibella, Ethiopia: Lalibella Airport","Lalibella, Ethiopia","",
"MQX","Makale, Ethiopia: Alula Aba Nega","Makale, Ethiopia","",
"MSW","Massawa, Ethiopia: Massawa Airport","Massawa, Ethiopia","",
"NEK","Nekemt, Ethiopia: Nekempti","Nekemt, Ethiopia","",
"SXU","Soddu, Ethiopia: Soddu Airport","Soddu, Ethiopia","",
"AMH","Arba Mintch, Ethiopia: Arba Mintch Ethiopia","Arba Mintch, Ethiopia","",
"AWA","Awasa, Ethiopia: Awasa Airport","Awasa, Ethiopia","",
"BEI","Beica, Ethiopia: Beica","Beica, Ethiopia","",
"GDE","Gode, Ethiopia: Gode Airport","Gode, Ethiopia","",
"ABK","Kabri Dar, Ethiopia: Kabri Dar","Kabri Dar, Ethiopia","",
"LFO","Kelafo, Ethiopia: Kelafo Airport","Kelafo, Ethiopia","",
"MKS","Mekane, Ethiopia: Mekane Airport","Mekane, Ethiopia","",
"LKM","Nekempt, Ethiopia: Nekempti","Nekempt, Ethiopia","",
"SHC","Shire Indaselassie, Ethiopia: Shire","Shire Indaselassie, Ethiopia","",
"TIE","Tippi, Ethiopia: Tippi","Tippi, Ethiopia","",
"ASM","Asmara, Eritrea: Asmara Airport","Asmara, Eritrea","",
"ASA","Assab, Eritrea: Assab Airport","Assab, Eritrea","",
"MSW","Massawa, Eritrea: Massawa Airport","Massawa, Eritrea","",
"JIB","Djibouti, Djibouti: Djibouti/Ambouli","Djibouti, Djibouti","",
"JIB","Djibouti, Djibouti: Ambouli","Djibouti, Djibouti","",
"OBC","Obock, Djibouti: Obock Airport","Obock, Djibouti","",
"LBQ","Lambarene, Gabon: Lambarene Airport","Lambarene, Gabon","",
"LEO","Leconi, Gabon: Leconi Airport","Leconi, Gabon","",
"LBV","Libreville, Gabon: Leon Mba International","Libreville, Gabon","",
"MFF","Moanda, Gabon: Moanda Airport","Moanda, Gabon","",
"MJL","Mouila, Gabon: Mouila Airport","Mouila, Gabon","",
"POG","Port Gentil, Gabon: Port Gentil Airport","Port Gentil, Gabon","",
"TCH","Tchibanga, Gabon: Tchibanga Airport","Tchibanga, Gabon","",
"BMM","Bitam, Gabon: Bitam","Bitam, Gabon","",
"BGB","Booue, Gabon: Booue","Booue, Gabon","",
"GKO","Kongo-Boumba, Gabon: Kongo-Boumba","Kongo-Boumba, Gabon","",
"MKU","Makokou, Gabon: Makokou Airport","Makokou, Gabon","",
"MYB","Mayoumba, Gabon: Mayoumba Airport","Mayoumba, Gabon","",
"MVB","Mvengue, Gabon: Mvengue Gabon","Mvengue, Gabon","",
"KDJ","N Djole, Gabon: N Djole","N Djole, Gabon","",
"NKA","Nkan, Gabon: Nkan Airport","Nkan, Gabon","",
"OKN","Okondja, Gabon: Okondja Airport","Okondja, Gabon","",
"OMB","Omboue, Gabon: Omboue Airport","Omboue, Gabon","",
"OYE","Oyem, Gabon: Oyem Gabon","Oyem, Gabon","",
"BJL","Banjul, The Gambia: Yundum International","Banjul, The Gambia","",
"ACC","Accra, Ghana: Kotoka","Accra, Ghana","",
"KMS","Kumasi, Ghana: Kumasi Airport","Kumasi, Ghana","",
"TKD","Takoradi, Ghana: Takoradi Airport","Takoradi, Ghana","",
"TML","Tamale, Ghana: Tamale Airport","Tamale, Ghana","",
"CKY","Conakry, Guinea: Conakry Airport","Conakry, Guinea","",
"KNN","Kankan, Guinea: Kankan Airport","Kankan, Guinea","",
"LEK","Labe, Guinea: Labe Airport","Labe, Guinea","",
"MCA","Macenta, Guinea: Macenta Airport","Macenta, Guinea","",
"SII","Sidi Ifni, Infini-Morocco: Sidi Ifni Airport","Sidi Ifni, Infini-Morocco","",
"ABJ","Abidjan, Cote d Ivoire (formerly Ivory Coast): Abidjan/Port Bouet","Abidjan, Cote d Ivoire (formerly Ivory Coast)","",
"AQJ","Aqaba, Jordan: King Hussein International","Aqaba, Jordan","",
"ADJ","Amman, Jordan: King Abdullah Ben","Amman, Jordan","",
"/AJ","Amman, Jordan: (Amman Mean)","Amman, Jordan","",
"KWI","Kuwait, Kuwait: Kuwait International /Magwa","Kuwait, Kuwait","",
"BEY","Beirut, Lebanon: Beirut International","Beirut, Lebanon","",
"MCT","Muscat, Oman: Seeb International","Muscat, Oman","",
"SLL","Salalah, Oman: Salalah Airport","Salalah, Oman","",
"SHJ","Sharjah, Oman: Sharjah Airport","Sharjah, Oman","",
"TTH","Thumrait, Oman: Thumrait Airport","Thumrait, Oman","",
"MSH","Masirah, Oman: Raf Station","Masirah, Oman","",
"DOH","Doha, Qatar: Doha International","Doha, Qatar","",
"ADE","Aden, People's Democratic Republic Of Yemen: Aden International","Aden, People's Democratic Republic Of Yemen","",
"RIY","Riyan, People's Democratic Republic Of Yemen: Riyan Airport","Riyan, People's Democratic Republic Of Yemen","",
"BHN","Beihan, People's Democratic Republic Of Yemen: Beihan Airport","Beihan, People's Democratic Republic Of Yemen","",
"AHB","Abha, Saudi Arabia: Abha Airport","Abha, Saudi Arabia","",
"XWP","Al Kharj, Saudi Arabia: Al Kharj Air Base","Al Kharj, Saudi Arabia","",
"AQI","Qaisumah, Saudi Arabia: Qaisumah Airport","Qaisumah, Saudi Arabia","",
"ABT","Al-Baha, Saudi Arabia: Al Aqiq","Al-Baha, Saudi Arabia","",
"QDM","Dammam, Saudi Arabia: King Fahd International","Dammam, Saudi Arabia","",
"DMM","Dammam, Saudi Arabia: King Fahd International","Dammam, Saudi Arabia","",
"DHA","Dhahran, Saudi Arabia: Dhahran Airport","Dhahran, Saudi Arabia","",
"ELQ","Gassim, Saudi Arabia: Gassim","Gassim, Saudi Arabia","",
"HBT","Hafr Al Batin, Saudi Arabia: Hafr Al Batin Airport","Hafr Al Batin, Saudi Arabia","",
"HAS","Hail, Saudi Arabia: Hail Airport","Hail, Saudi Arabia","",
"JED","Jeddah, Saudi Arabia: Jeddah International","Jeddah, Saudi Arabia","",
"QJB","Jubail, Saudi Arabia: Jubail Airport","Jubail, Saudi Arabia","",
"KMX","Khamis Mushait, Saudi Arabia: Khamis Mushait Airport","Khamis Mushait, Saudi Arabia","",
"XWG","King Khalid Military City, Saudi Arabia: King Khalid Military City Airport","King Khalid Military City, Saudi Arabia","",
"MED","Medina, Saudi Arabia: Medina Airport","Medina, Saudi Arabia","",
"RAH","Rafha, Saudi Arabia: Rafha Airport","Rafha, Saudi Arabia","",
"RUH","Riyadh, Saudi Arabia: Riyadh International","Riyadh, Saudi Arabia","",
"RUH","Riyadh, Saudi Arabia: King Khalid International","Riyadh, Saudi Arabia","",
"XWM","Riyadh, Saudi Arabia: Riyadh Military","Riyadh, Saudi Arabia","",
"TUU","Tabuk, Saudi Arabia: Tabuk Airport","Tabuk, Saudi Arabia","",
"TIF","Taif, Saudi Arabia: Taif Airport","Taif, Saudi Arabia","",
"BBH","Al-Baha, Saudi Arabia: Al Baha","Al-Baha, Saudi Arabia","",
"RAE","Arar, Saudi Arabia: Arar Airport","Arar, Saudi Arabia","",
"BHH","Bisha, Saudi Arabia: Bisha Airport","Bisha, Saudi Arabia","",
"GIZ","Gizan, Saudi Arabia: Gizan Saudia Arabia","Gizan, Saudi Arabia","",
"URY","Gurayat, Saudi Arabia: Guriat","Gurayat, Saudi Arabia","",
"HOF","Hafuf, Saudi Arabia: Hafuf Airport","Hafuf, Saudi Arabia","",
"HOF","Hoffuf, Saudi Arabia: Hoffuf S A","Hoffuf, Saudi Arabia","",
"AJF","Jouf, Saudi Arabia: Al Jouf","Jouf, Saudi Arabia","",
"EAM","Nejran, Saudi Arabia: Nejran Airport","Nejran, Saudi Arabia","",
"/RY","Riyadh, Saudi Arabia: (Riyadh Mean)","Riyadh, Saudi Arabia","",
"SHW","Sharawrah, Saudi Arabia: Sharawrah Airport","Sharawrah, Saudi Arabia","",
"SHW","Sharurah, Saudi Arabia: Sharurah Airport","Sharurah, Saudi Arabia","",
"TUI","Turaif, Saudi Arabia: Turaif Airport","Turaif, Saudi Arabia","",
"EJH","Wedjh, Saudi Arabia: Wedjh Airport","Wedjh, Saudi Arabia","",
"YNB","Yanbu, Saudi Arabia: Yanbu Airport","Yanbu, Saudi Arabia","",
"ALP","Aleppo, Syrian Arab Republic: Neirab","Aleppo, Syrian Arab Republic","",
"DAM","Damascus, Syrian Arab Republic: Mezze","Damascus, Syrian Arab Republic","",
"KAC","Kameshli, Syrian Arab Republic: Kamishly","Kameshli, Syrian Arab Republic","",
"PMS","Palmyra, Syrian Arab Republic: Palmyra Airport","Palmyra, Syrian Arab Republic","",
"DEZ","Deir Ezzor, Syrian Arab Republic: Al Jafrah/Deir Ezzor","Deir Ezzor, Syrian Arab Republic","",
"AUH","Abu Dhabi, United Arab Emirates: Abu Dhabi International","Abu Dhabi, United Arab Emirates","",
"ARP","Aragip, Papua New Guinea: Aragip Airport","Aragip, Papua New Guinea","",
"AOA","Aroa, Papua New Guinea: Aroa Airport","Aroa, Papua New Guinea","",
"BAA","Bialla, Papua New Guinea: Bialla Airport","Bialla, Papua New Guinea","",
"BUA","Buka Islands, Papua New Guinea: Buka","Buka Islands, Papua New Guinea","",
"EIA","Eia, Papua New Guinea: Eia","Eia, Papua New Guinea","",
"GAR","Garaina, Papua New Guinea: Garaina Airport","Garaina, Papua New Guinea","",
"IHU","Ihu, Papua New Guinea: Ihu Airport","Ihu, Papua New Guinea","",
"KMF","Kamina, Papua New Guinea: Kamina Airport","Kamina, Papua New Guinea","",
"WFJ","Karias, Papua New Guinea: Karias","Karias, Papua New Guinea","",
"KSN","Karias, Papua New Guinea: Karias","Karias, Papua New Guinea","",
"KIE","Kieta, Papua New Guinea: Aropa","Kieta, Papua New Guinea","",
"KOR","Kokoro, Papua New Guinea: Kokoro Airport","Kokoro, Papua New Guinea","",
"KDE","Koroba, Papua New Guinea: Koroba","Koroba, Papua New Guinea","",
"CMU","Kundiawa, Papua New Guinea: Chimbu","Kundiawa, Papua New Guinea","",
"LAB","Lablab, Papua New Guinea: Lab Lab","Lablab, Papua New Guinea","",
"LAE","Lae, Papua New Guinea: Lae Airport","Lae, Papua New Guinea","",
"LAC","Lae, Papua New Guinea: Lae Airport","Lae, Papua New Guinea","",
"/LE","Lae, Papua New Guinea: Lae Papua","Lae, Papua New Guinea","",
"LSA","Losuia, Papua New Guinea: Losuia Airport","Losuia, Papua New Guinea","",
"MAS","Manus Isl., Papua New Guinea: Manus Isl","Manus Isl., Papua New Guinea","",
"WPM","Wipim, Papua New Guinea: Wipim Airport","Wipim, Papua New Guinea","",
"ATN","Namatanai, Papua New Guinea: Namatanai Airport","Namatanai, Papua New Guinea","",
"NKN","Nankina, Papua New Guinea: Nankina Airport","Nankina, Papua New Guinea","",
"XOM","Omkalai, Papua New Guinea: Omkalai Airport","Omkalai, Papua New Guinea","",
"OML","Omkalai, Papua New Guinea: Omkalai","Omkalai, Papua New Guinea","",
"PMP","Pimaga, Papua New Guinea: Pimaga Airport","Pimaga, Papua New Guinea","",
"SFU","Safia, Papua New Guinea: Safia Airport","Safia, Papua New Guinea","",
"SSS","Siassi, Papua New Guinea: Siassi Airport","Siassi, Papua New Guinea","",
"SPH","Sopu, Papua New Guinea: Sopu","Sopu, Papua New Guinea","",
"TPI","Tapini, Papua New Guinea: Tapini Airport","Tapini, Papua New Guinea","",
"TIZ","Tari, Papua New Guinea: Tari Airport","Tari, Papua New Guinea","",
"TEP","Teptep, Papua New Guinea: Teptep","Teptep, Papua New Guinea","",
"TFI","Tufi, Papua New Guinea: Tufi","Tufi, Papua New Guinea","",
"VAI","Vanimo, Papua New Guinea: Vanimo Airport","Vanimo, Papua New Guinea","",
"WKN","Wakunai, Papua New Guinea: Wakunai Airport","Wakunai, Papua New Guinea","",
"WUG","Wau, Papua New Guinea: Wau Papua New Guinea","Wau, Papua New Guinea","",
"ROR","Koror, Palau Island: Babelthuap","Koror, Palau Island","",
"KSA","Kosrae, Palau Island: Kosrae Airport","Kosrae, Palau Island","",
"PNI","Ponape, Palau Island: Ponape Sea Plane Base","Ponape, Palau Island","",
"TKK","Truk, Palau Island: Truk International","Truk, Palau Island","",
"YAP","Yap, Palau Island: Yap International","Yap, Palau Island","",
"ULI","Ulithi, Palau Island: Ulithi Airport","Ulithi, Palau Island","",
"KSA","Kosrae, Micronesia: Kosrae Airport","Kosrae, Micronesia","",
"PNI","Ponape, Micronesia: Ponape Sea Plane Base","Ponape, Micronesia","",
"TKK","Truk, Micronesia: Truk International","Truk, Micronesia","",
"YAP","Yap, Micronesia: Yap International","Yap, Micronesia","",
"ULI","Ulithi, Micronesia: Ulithi Airport","Ulithi, Micronesia","",
"CCK","Cocos (Keeling) Islands, Cocos Islands-Australia: Cocos Island International","Cocos (Keeling) Islands, Cocos Islands-Australia","",
"RAR","Rarotongo, Cook IslandsNew Zealand: Rarotonga/Nikao","Rarotongo, Cook Islands-New Zealand","",
"AIT","Aitutaki, Cook Islands-New Zealand: Aitutaki","Aitutaki, Cook Islands-New Zealand","",
"MGS","Mangaia, Cook Islands-New Zealand: Mangaia Cook Island","Mangaia, Cook Islands-New Zealand","",
"IUE","Niue Island, Cook Islands-New Zealand: Niue International","Niue Island, Cook Islands-New Zealand","",
"FUN","Funafuti, Tuvalu-UK: Funafuti International","Funafuti, Tuvalu-UK","",
"LEV","Bureta, Fiji Islands: Bureta Airport","Bureta, Fiji Islands","",
"ICI","Cicia, Fiji Islands: Cicia Airport","Cicia, Fiji Islands","",
"LBS","Lambasa, Fiji Islands: Lambasa Airport","Lambasa, Fiji Islands","",
"NAN","Nadi, Fiji Islands: Nadi International","Nadi, Fiji Islands","",
"SLE","Salem, OR: Mcnary Field","Salem, OR","Oregon",
"TTD","Troutdale, OR: Portland Troutdale","Troutdale, OR","Oregon",
"CVO","Corvallis, OR: Corvallis","Corvallis, OR","Oregon",
"CVO","Corvallis, OR: Corvallis Airport","Corvallis, OR","Oregon",
"JDA","John Day, OR: John Day Airport","John Day, OR","Oregon",
"QMC","Mcminnville, OR: Mc Minnville Municipal","Mcminnville, OR","Oregon",
"ONP","Newport, OR: Newport Airport","Newport, OR","Oregon",
"SUO","Sun River, OR: Sun River Airport","Sun River, OR","Oregon",
"OTS","Anacortes, WA: Anacortes Airport","Anacortes, WA","Washington",
"VWO","Arlington, WA: Arlington Municipal","Arlington, WA","Washington",
"BLI","Bellingham, WA: Bellingham International","Bellingham, WA","Washington",
"BWS","Blaine, WA: Blaine Municipal","Blaine, WA","Washington",
"PWT","Bremerton, WA: Kitsap County","Bremerton, WA","Washington",
"QQO","Brewster, WA: Anderson Field","Brewster, WA","Washington",
"VWE","Chelan, WA: Chelan Municipal","Chelan, WA","Washington",
"WQI","Connell, WA: Connell City","Connell, WA","Washington",
"XWE","Copalis, WA: Copalis State","Copalis, WA","Washington",
"WBV","Eastsound, WA: Orcas Island","Eastsound, WA","Washington",
"ESD","Eastsound, WA: Orcas Island","Eastsound, WA","Washington",
"WA8","Eastsound, WA: Waldronaire","Eastsound, WA","Washington",
"ELN","Ellensburg, WA: Bowers Field","Ellensburg, WA","Washington",
"EPH","Ephrata/Moses Lake, WA: Ephrata","Ephrata/Moses Lake, WA","Washington",
"WCG","Friday Harbor, WA: Friday Harbor Airport","Friday Harbor, WA","Washington",
"FRD","Friday Harbor, WA: Friday Harbor Airport","Friday Harbor, WA","Washington",
"HQM","Hoquiam, WA: Bowerman","Hoquiam, WA","Washington",
"KEH","Kenmore, WA: Kenmore Air Harbor","Kenmore, WA","Washington",
"ZXX","Kennewick, WA: Vista Field","Kennewick, WA","Washington",
"LPS","Lopez Island, WA: Lopez Island Airport","Lopez Island, WA","Washington",
"MWH","Moses Lake, WA: Grant County","Moses Lake, WA","Washington",
"MVW","Mount Vernon, WA: Skagit Regional/Bay View","Mount Vernon, WA","Washington",
"ODW","Oak Harbor, WA: Oak Harbor Airpark","Oak Harbor, WA","Washington",
"XWZ","Okanogan, WA: Okanogan Legion","Okanogan, WA","Washington",
"OLM","Olympia, WA: Olympia Airport","Olympia, WA","Washington",
"FVH","Othello, WA: Othello Municipal","Othello, WA","Washington",
"PSC","Pasco/Kennewick/Richland, WA: Tri Cities","Pasco/Kennewick/Richland, WA","Washington",
"CLM","Port Angeles, WA: William R Fairchild","Port Angeles, WA","Washington",
"XWK","Port Orchard, WA: Port Orchard Airport","Port Orchard, WA","Washington",
"TWD","Port Townsend, WA: Jefferson County International","Port Townsend, WA","Washington",
"RQE","Prosser, WA: Prosser Airport","Prosser, WA","Washington",
"PUW","Pullman, WA: Pullman Moscow Regional","Pullman, WA","Washington",
"JZN","Quincy, WA: Quincy Municipal","Quincy, WA","Washington",
"RNT","Renton, WA: Renton Municipal","Renton, WA","Washington",
"RLD","Richland, WA: Richland Airport","Richland, WA","Washington",
"RCE","Roche Harbor, WA: Roche Harbor Airport","Roche Harbor, WA","Washington",
"RSJ","Rosario, WA: Rosario Sea Plane Base","Rosario, WA","Washington",
"BFI","Seattle, WA: King County -Boeing Field","Seattle, WA","Washington",
"SQV","Sequim, WA: Sequim Valley","Sequim, WA","Washington",
"PAE","Everett, WA: Snohomish County Paine Field","Everett, WA","Washington",
"SKA","Spokane, WA: Fairchild Air Force Base","Spokane, WA","Washington",
"GEG","Spokane, WA: Spokane International","Spokane, WA","Washington",
"SFF","Spokane, WA: Felts Field","Spokane, WA","Washington",
"QQI","Sunnyside, WA: Sunnyside Municipal","Sunnyside, WA","Washington",
"GRF","Tacoma, WA: Gray Army Air Field","Tacoma, WA","Washington",
"TCM","Tacoma, WA: Mcchord Air Force Base","Tacoma, WA","Washington",
"TIW","Tacoma, WA: Tacoma Narrows","Tacoma, WA","Washington",
"ALW","Walla Walla, WA: Walla Walla City County","Walla Walla, WA","Washington",
"ZXZ","Waterville, WA: Waterville Airport","Waterville, WA","Washington",
"EAT","Wenatchee, WA: Pangborn Field","Wenatchee, WA","Washington",
"WSX","Westsound, WA: Westsound Airport","Westsound, WA","Washington",
"/PT","Balboa C.Z/Panama City, Panama Canal Zone: /Pt Balbao/Panama City","Balboa C.Z/Panama City, Panama Canal Zone","",
"ACU","Achutupo, Panama Republic: Achutupo Airport","Achutupo, Panama Republic","",
"BLB","Balboa, Panama Republic: Albrook","Balboa, Panama Republic","",
"BOC","Bocas Del Toro, Panama Republic: Bocas Del Toro International","Bocas Del Toro, Panama Republic","",
"CHX","Changuinola, Panama Republic: Changuinola 1","Changuinola, Panama Republic","",
