"AIRPORT","TR_AIRPORT_NAME","TR_CITY_NAME","TR_STATE_NAME",
"XWS","Oliktok, AK: Oliktok Lrrs","Oliktok, AK","Alaska",
"XWR","Oosik Sea Plane Base it, AK: Oosik Sea Plane Base it Airport","Oosik Split, AK","Alaska",
"KOZ","Ouzinkie, AK: Ouzinkie Airport","Ouzinkie, AK","Alaska",
"PBK","Pack Creek, AK: Pack Creek Airport","Pack Creek, AK","Alaska",
"PFA","Paf Warren, AK: Paf Warren Airport","Paf Warren, AK","Alaska",
"PMU","Paimiut, AK: Paimiut Airport","Paimiut, AK","Alaska",
"PCE","Painter Creek, AK: Painter Creek Airport","Painter Creek, AK","Alaska",
"PAQ","Palmer, AK: Palmer Municipal","Palmer, AK","Alaska",
"KPK","Parks, AK: Parks Sea Plane Base Alas","Parks, AK","Alaska",
"KPH","Pauloff Harbor, AK: Pauloff Harbor Airport","Pauloff Harbor, AK","Alaska",
"WQJ","Peard Bay, AK: Peard Bay Airport","Peard Bay, AK","Alaska",
"PDB","Pedro Bay, AK: Pedro Bay Airport","Pedro Bay, AK","Alaska",
"PEC","Pelican, AK: Pelican Sea Plane Base","Pelican, AK","Alaska",
"KPV","Perryville, AK: Perryville Airport","Perryville, AK","Alaska",
"VZL","King Cove, AK: Peter Pan Seafoods","King Cove, AK","Alaska",
"PSG","Petersburg, AK: Petersburg Sea Plane Base","Petersburg, AK","Alaska",
"PNF","Peterson's Point, AK: Peterson's Point Airport","Peterson's Point, AK","Alaska",
"UGB","Pilot Point, AK: Ugashik Bay","Pilot Point, AK","Alaska",
"PIP","Pilot Point, AK: Pilot Point","Pilot Point, AK","Alaska",
"PQS","Pilot Station, AK: Pilot Station","Pilot Station, AK","Alaska",
"PTU","Platinum, AK: Platinum Airport","Platinum, AK","Alaska",
"PTR","Pleasant Harbour, AK: Pleasant Harbour Airport","Pleasant Harbour, AK","Alaska",
"PBA","Point Barrow, AK: Point Barrow Narl","Point Barrow, AK","Alaska",
"PHO","Point Hope, AK: Point Hope Airport","Point Hope, AK","Alaska",
"PIZ","Point Lay, AK: Point Lay Dew Station","Point Lay, AK","Alaska",
"PRT","Point Retreat, AK: Coast Guard Heliport","Point Retreat, AK","Alaska",
"POQ","Polk Inlet, AK: Polk Inlet Airport","Polk Inlet, AK","Alaska",
"PVY","Pope Vanoy, AK: Pope Vanoy Airport","Pope Vanoy, AK","Alaska",
"PCK","Porcupine Creek, AK: Porcupine Creek Airport","Porcupine Creek, AK","Alaska",
"PTD","Port Alexander, AK: Port Alexander Airport","Port Alexander, AK","Alaska",
"PTC","Port Alice, AK: Port Alice Airport","Port Alice, AK","Alaska",
"PTA","Port Alsworth, AK: Port Alsworth Airport","Port Alsworth, AK","Alaska",
"PTL","Port Armstrong, AK: Port Armstrong Airport","Port Armstrong, AK","Alaska",
"KPY","Port Bailey, AK: Port Bailey Airport","Port Bailey, AK","Alaska",
"KPC","Port Clarence, AK: Port Clarence Cgs","Port Clarence, AK","Alaska",
"PGM","Port Graham, AK: Port Graham Airport","Port Graham, AK","Alaska",
"PTH","Port Heiden, AK: Port Heiden Airport","Port Heiden, AK","Alaska",
"ORI","Port Lions, AK: Port Lions Airport","Port Lions, AK","Alaska",
"PML","Port Moller, AK: Port Moller Afs","Port Moller, AK","Alaska",
"PPV","Port Protection, AK: Port Protection Airport","Port Protection, AK","Alaska",
"WQY","Port Wakefield, AK: Port Wakefield Airport","Port Wakefield, AK","Alaska",
"KPR","Port Williams, AK: Port Williams Alas","Port Williams, AK","Alaska",
"PUO","Prudhoe Bay, AK: Prudhoe Bay Airport","Prudhoe Bay, AK","Alaska",
"PUO","Prudhoe Bay, AK: Prudhoe Bay Airport","Prudhoe Bay, AK","Alaska",
"VZQ","Puale Bay, AK: Puale Bay Airport","Puale Bay, AK","Alaska",
"UQE","Queen, AK: Queen Airport","Queen, AK","Alaska",
"RMP","Rampart, AK: Rampart Airport","Rampart, AK","Alaska",
"RDV","Red Devil, AK: Red Devil Airport","Red Devil, AK","Alaska",
"RDB","Red Dog, AK: Red Dog Mine","Red Dog, AK","Alaska",
"WQV","Round Island, AK: Round Island Airport","Round Island, AK","Alaska",
"RBY","Ruby, AK: Ruby Airport","Ruby, AK","Alaska",
"RSH","Russian Mission, AK: Russian Mission Airport","Russian Mission, AK","Alaska",
"SAG","Sagwon, AK: Sagwon Airport","Sagwon, AK","Alaska",
"STG","St. George Island, AK: St. George Island Airport","St. George Island, AK","Alaska",
"WSJ","San Juan, AK: San Juan Airport","San Juan, AK","Alaska",
"SDP","Sandpoint, AK: Sand Point","Sandpoint, AK","Alaska",
"SCM","Scammon Bay, AK: Scammon Bay Airport","Scammon Bay, AK","Alaska",
"SYB","Seal Bay, AK: Seal Bay Airport","Seal Bay, AK","Alaska",
"WLK","Selawik, AK: Selawik Airport","Selawik, AK","Alaska",
"SWD","Seward, AK: Seward Airport","Seward, AK","Alaska",
"SHX","Shageluk, AK: Shageluk Airport","Shageluk, AK","Alaska",
"SKK","Shaktoolik, AK: Shaktolik","Shaktoolik, AK","Alaska",
"SXP","Sheldon Point, AK: Sheldons Point","Sheldon Point, AK","Alaska",
"SYA","Shemya, AK: Shemya Air Force Base","Shemya, AK","Alaska",
"VSF","Springfield, VT: Hartness State","Springfield, VT","Vermont",
"MVL","Morrisville, VT: Morrisville Airport","Morrisville, VT","Vermont",
"EFK","Newport, VT: Newport Airport","Newport, VT","Vermont",
"MVL","Stowe, VT: Stowe Airport","Stowe, VT","Vermont",
"ARX","Asbury Park, NJ: Asbury Park/Monmouth County","Asbury Park, NJ","New Jersey",
"AIY","Atlantic City, NJ: Bader Field","Atlantic City, NJ","New Jersey",
"BLM","Belmar, NJ: Allaire","Belmar, NJ","New Jersey",
"WWD","Cape May, NJ: Cape May County","Cape May, NJ","New Jersey",
"WRI","Fort Dix, NJ: Mc Guire Air Force Base","Fort Dix, NJ","New Jersey",
"NEL","Lakehurst, NJ: Lakehurst Naec","Lakehurst, NJ","New Jersey",
"XXE","Lakewood, NJ: Lakewood Airport","Lakewood, NJ","New Jersey",
"MIV","Millville, NJ: Millville Municipal","Millville, NJ","New Jersey",
"MMU","Morristown, NJ: Morristown Municipal","Morristown, NJ","New Jersey",
"TEB","Teterboro, NJ: Teterboro Airport","Teterboro, NJ","New Jersey",
"PCT","Princeton, NJ: Princeton Airport","Princeton, NJ","New Jersey",
"TTN","Trenton, NJ: Mercer County","Trenton, NJ","New Jersey",
"/AY","Atlantic City, NJ: /Ay Navy Air Field ec","Atlantic City, NJ","New Jersey",
"/AY","Atlantic City, NJ: /Ay Atlantic City Metro-Up 1","Atlantic City, NJ","New Jersey",
"LDJ","Linden, NJ: Linden Airport","Linden, NJ","New Jersey",
"LLY","Mount Holly, NJ: Mount Holly Airport","Mount Holly, NJ","New Jersey",
"TEB","Teterboro, NJ: Teterboro Airport","Teterboro, NJ","New Jersey",
"ALB","Albany, NY: Albany County","Albany, NY","New York",
"AXB","Alexandria Bay, NY: Alexandria Bay Airport","Alexandria Bay, NY","New York",
"BGM","Binghamton/Endct/Jhnsn Cty, NY: Broome County","Binghamton/Endct/Jhnsn Cty, NY","New York",
"BUF","Buffalo, NY: Buffalo Niagara International","Buffalo, NY","New York",
"HTO","East Hampton, NY: East Hampton Airport","East Hampton, NY","New York",
"HTO","East Hampton, NY: East Hampton Airport","East Hampton, NY","New York",
"ELM","Elmira/Corning, NY: Harris Hill Glider Port","Elmira/Corning, NY","New York",
"FRG","Farmingdale, NY: Republic","Farmingdale, NY","New York",
"DQK","Fort Drum, NY: Wheeler-Sack Army Airfield","Fort Drum, NY","New York",
"JHC","Garden City, NY: Island Heliport","Garden City, NY","New York",
"GFL","Glens Falls, NY: Warren County","Glens Falls, NY","New York",
"ISP","Islip, NY: Long Island-Macarthur","Islip, NY","New York",
"ITH","Ithaca/Cortland, NY: Tompkins County","Ithaca/Cortland, NY","New York",
"JHW","Jamestown, NY: Chautauqua County","Jamestown, NY","New York",
"MSS","Massena, NY: Richards Field","Massena, NY","New York",
"MGJ","Montgomery, NY: Orange County","Montgomery, NY","New York",
"OIC","Norwich, NY: Eaton","Norwich, NY","New York",
"LGA","New York, NY: La Guardia","New York, NY","New York",
"EWR","Newark, NJ: Newark Liberty International","Newark, NJ","New Jersey",
"JPB","New York, NY: Pan Am Building Heliport","New York, NY","New York",
"JRB","New York, NY: Wall Street Heliport","New York, NY","New York",
"TSS","New York, NY: East 34th Street","New York, NY","New York",
"JRA","New York, NY: West 30th Street Heliport","New York, NY","New York",
"WTC","New York, NY: World Trade Center Heliport","New York, NY","New York",
"NYC","New York, NY: Metropolitan Area","New York, NY","New York",
"SWF","Newburgh/Poughkeepsie, NY: Stewart","Newburgh/Poughkeepsie, NY","New York",
"IAG","Niagara Falls, NY: Niagara Falls International","Niagara Falls, NY","New York",
"OGS","Ogdensburg, NY: Ogdensburg International","Ogdensburg, NY","New York",
"OLE","Olean, NY: Olean Municipal","Olean, NY","New York",
"ONH","Oneonta, NY: Oneonta Municipal","Oneonta, NY","New York",
"WQA","Ovid, NY: Ovid Airport","Ovid, NY","New York",
"PLB","Plattsburg, NY: Clinton County","Plattsburg, NY","New York",
"POU","Poughkeepsie, NY: Dutchess County","Poughkeepsie, NY","New York",
"ROC","Rochester, NY: Rochester Monroe County","Rochester, NY","New York",
"RME","Rome, NY: Griffiss Air Force Base","Rome, NY","New York",
"SLK","Saranac Lake/Lake Placid, NY: Adirondack","Saranac Lake/Lake Placid, NY","New York",
"VWK","Saratoga Springs, NY: Saratoga County","Saratoga Springs, NY","New York",
"DFW","Dallas/Ft. Worth, TX: Dallas Ft. Worth Regional     7403     Dfw","Dallas/Ft. Worth, TX","Texas",
"DAL","Dallas, TX: Dallas Love Field","Dallas/Ft. Worth, TX","Texas",
"FTW","Dallas/Ft. Worth, TX: Meacham Field","Dallas/Ft. Worth, TX","Texas",
"ADS","Dallas/Ft.Worth, TX: Addison","Dallas/Ft.Worth, TX","Texas",
"FWH","Dallas/Ft.Worth, TX: Carswell Air Force Base","Dallas/Ft.Worth, TX","Texas",
"DFW","Dallas/Ft.Worth, TX: Dallas/Ft Worth International","Dallas/Ft.Worth, TX","Texas",
"DNE","Dallas/Ft.Worth, TX: Dallas North","Dallas/Ft.Worth, TX","Texas",
"JDB","Dallas/Ft.Worth, TX: Downtown Heliport","Dallas/Ft.Worth, TX","Texas",
"AFW","Dallas/Ft.Worth, TX: Fort Worth Alliance","Dallas/Ft.Worth, TX","Texas",
"DAL","Dallas, TX: Dallas Love Field","Dallas, TX","Texas",
"FTW","Dallas/Ft.Worth, TX: Fort Worth Meacham","Dallas/Ft.Worth, TX","Texas",
"RBD","Dallas/Ft.Worth, TX: Redbird","Dallas/Ft.Worth, TX","Texas",
"DRT","Del Rio, TX: Del Rio International","Del Rio, TX","Texas",
"DLF","Del Rio, TX: Laughlin Air Force Base","Del Rio, TX","Texas",
"EGP","Eagle Pass, TX: Eagle Pass Municipal","Eagle Pass, TX","Texas",
"BIF","El Paso, TX: Biggs Army Air Field","El Paso, TX","Texas",
"ELP","El Paso, TX: El Paso International","El Paso, TX","Texas",
"FWH","Fort Worth, TX: Carswell Air Force Base","Fort Worth, TX","Texas",
"FST","Ft. Stockton, TX: Fort Stockton Pecos County","Ft. Stockton, TX","Texas",
"GLS","Galveston, TX: Scholes Field","Galveston, TX","Texas",
"GVT","Greenville, TX: Majors","Greenville, TX","Texas",
"HRL","Harlingen/San Benito, TX: Harlingen Industrial Airprk","Harlingen/San Benito, TX","Texas",
"VWX","Hondo, TX: Hondo Municipal","Hondo, TX","Texas",
"EFD","Houston, TX: Ellington Field","Houston, TX","Texas",
"IAH","Houston, TX: Houston Intercontinental","Houston, TX","Texas",
"HOU","Houston, TX: William P Hobby","Houston, TX","Texas",
"ERV","Kerrville, TX: Kerrville Municipal","Kerrville, TX","Texas",
"GRK","Killeen, TX: Robert Gray Army Air Field","Killeen, TX","Texas",
"ILE","Killeen, TX: Killeen Municipal","Killeen, TX","Texas",
"NQI","Kingsville, TX: Kingsville Nas","Kingsville, TX","Texas",
"LJN","Lake Jackson, TX: Brazoria County","Lake Jackson, TX","Texas",
"LRD","Laredo, TX: Laredo Air Force Base","Laredo, TX","Texas",
"LOI","Laredo, TX: Laredo International","Laredo, TX","Texas",
"GGG","Longview/Kilgor/Gladwatr, TX: Gregg County","Longview/Kilgor/Gladwatr, TX","Texas",
"LBB","Lubbock, TX: Lubbock Regional","Lubbock, TX","Texas",
"RQT","Lubbock, TX: Town and Country Airpark","Lubbock, TX","Texas",
"LBB","Lubbock, TX: Lubbock International","Lubbock, TX","Texas",
"REE","Lubbock, TX: Reese Air Force Base","Lubbock, TX","Texas",
"LFK","Lufkin, TX: Angelina County","Lufkin, TX","Texas",
"XWY","Mcgregor, TX: Mcgregor Municipal","Mcgregor, TX","Texas",
"MAF","Midland/Odessa, TX: Midland Regional Air Trml","Midland/Odessa, TX","Texas",
"MAF","Midland/Odessa, TX: Midland International","Midland/Odessa, TX","Texas",
"VWH","Midland/Odessa, TX: Odessa Schlemeyer Field","Midland/Odessa, TX","Texas",
"MDD","Midland/Odessa, TX: Midland Airpark","Midland/Odessa, TX","Texas",
"VZH","Mineola, TX: Mineola Wisener","Mineola, TX","Texas",
"MWL","Mineral Wells, TX: Mineral Wells Airport","Mineral Wells, TX","Texas",
"MFE","Mission/Mcallen/Edinburg, TX: Miller International","Mission/Mcallen/Edinburg, TX","Texas",
"MPS","Mount Pleasant, TX: Mount Pleasant Municipal","Mount Pleasant, TX","Texas",
"PRX","Paris, TX: Cox Field","Paris, TX","Texas",
"RKP","Rockport, TX: Aransas County","Rockport, TX","Texas",
"FAL","Roma, TX: Falcon State Park","Roma, TX","Texas",
"SJT","San Angelo, TX: Mathis Field","San Angelo, TX","Texas",
"RND","San Antonio, TX: Randolph Air Force Base","San Antonio, TX","Texas",
"SAT","San Antonio, TX: San Antonio International","San Antonio, TX","Texas",
"SKF","San Antonio, TX: Kelly Air Force Base","San Antonio, TX","Texas",
"QQY","San Marcos, TX: San Marcos Municipal","San Marcos, TX","Texas",
"SWI","Sherman, TX: Sherman Municipal","Sherman, TX","Texas",
"FVD","Sonora, TX: Sonora Municipal","Sonora, TX","Texas",
"SGR","Sugar Land, TX: Sugar Land/Hull Field","Sugar Land, TX","Texas",
"SWW","Sweetwater, TX: Avenger Field","Sweetwater, TX","Texas",
"TPL","Temple, TX: Draughon Miller Municipal","Temple, TX","Texas",
"KDK","Kodiak, AK: Kodiak Municipal","Kodiak, AK","Alaska",
"KGK","Koliganek, AK: Koliganek Airport","Koliganek, AK","Alaska",
"KCD","Kongiganak, AK: Kongiganak","Kongiganak, AK","Alaska",
"KKH","Kongiganak, AK: Kongiganak Airport","Kongiganak, AK","Alaska",
"KOT","Kotlik, AK: Kotlik Airport","Kotlik, AK","Alaska",
"OTZ","Kotzebue, AK: Ralph Wien Memorial","Kotzebue, AK","Alaska",
"KKA","Koyuk, AK: Koyuk Airport","Koyuk, AK","Alaska",
"KYU","Koyukuk, AK: Koyukuk Airport","Koyukuk, AK","Alaska",
"UUK","Kuparuk, AK: North Kuparuk","Kuparuk, AK","Alaska",
"KWT","Kwethluk, AK: Kwethluk Airport","Kwethluk, AK","Alaska",
"KWK","Kwigillingok, AK: Kwigillingok Airport","Kwigillingok, AK","Alaska",
"SGU","St. George, UT: St George Municipal","St. George, UT","Utah",
"KWN","Kwinhagak, AK: Alas","Kwinhagak, AK","Alaska",
"KLN","Larsen Bay, AK: Larsen Bay Airport","Larsen Bay, AK","Alaska",
"KLL","Levelock, AK: Levelock Airport","Levelock, AK","Alaska",
"UXA","Lik Camp, AK: Lik Camp Airport","Lik Camp, AK","Alaska",
"LVD","Lime Village, AK: Lime Village Airport","Lime Village, AK","Alaska",
"DIO","Little Diomede, AK: Little Diomede Airport","Little Diomede, AK","Alaska",
"LPW","Little Port Walter, AK: Little Port Walter Airport","Little Port Walter, AK","Alaska",
"LNI","Lonely, AK: Lonely Dew Station","Lonely, AK","Alaska",
"KMO","Manokotak, AK: Manokatak Sea Plane Base","Manokotak, AK","Alaska",
"RTE","Marguerite Bay, AK: Marguerite Bay Airport","Marguerite Bay, AK","Alaska",
"MLL","Marshall, AK: Marshall Airport","Marshall, AK","Alaska",
"VZA","Marvel Creek Mine, AK: Marvel Creek Mine Airport","Marvel Creek Mine, AK","Alaska",
"MXY","Mccarthy, AK: Mccarthy Airport","Mccarthy, AK","Alaska",
"KMC","Mccord, AK: Mccord Sea Plane Base","Mccord, AK","Alaska",
"MCG","Mcgrath, AK: Mc Grath","Mcgrath, AK","Alaska",
"MDR","Medfra, AK: Medfra Airport","Medfra, AK","Alaska",
"MYU","Mekoryuk, AK: Mekoryuk Airport","Mekoryuk, AK","Alaska",
"WMK","Meyers Chuck, AK: Meyers Chuck Sea Plane Base","Meyers Chuck, AK","Alaska",
"MDO","Middleton Island, AK: Middleton Island Airport","Middleton Island, AK","Alaska",
"MHM","Minchumina, AK: Minchumina Airport","Minchumina, AK","Alaska",
"MNT","Minto, AK: Minto Airport","Minto, AK","Alaska",
"MNT","Minto, AK: Minto Airport","Minto, AK","Alaska",
"VZB","Mitrofania, AK: Mitrofania Airport","Mitrofania, AK","Alaska",
"VZG","Moffet Bay, AK: Moffet Bay Airport","Moffet Bay, AK","Alaska",
"KMY","Moser Bay, AK: Moser Bay Airport","Moser Bay, AK","Alaska",
"MOS","Moses Point, AK: Moses Point Airport","Moses Point, AK","Alaska",
"MOU","Mountain Village, AK: Mountain Village Airport","Mountain Village, AK","Alaska",
"VZC","Mush Bay, AK: Mush Bay Airport","Mush Bay, AK","Alaska",
"NNK","Naknek, AK: Naknek Airport","Naknek, AK","Alaska",
"WNA","Napakiak, AK: Napakiak Airport","Napakiak, AK","Alaska",
"PKA","Napaskiak, AK: Napaskiak Airport","Napaskiak, AK","Alaska",
"NKI","Naukiti, AK: Naukiti Airport","Naukiti, AK","Alaska",
"NEU","Nellie Juan, AK: Nellie Juan Airport","Nellie Juan, AK","Alaska",
"NLG","Nelson Lagoon, AK: Nelson Lagoon Airport","Nelson Lagoon, AK","Alaska",
"KNW","New Stuyahok, AK: New Stuyahok Airport","New Stuyahok, AK","Alaska",
"WWT","Newtok, AK: Newtok Airport","Newtok, AK","Alaska",
"NKV","Nichen Cove, AK: Nichin Cove Sea Plane Base","Nichen Cove, AK","Alaska",
"NME","Nightmute, AK: Nightmute Airport","Nightmute, AK","Alaska",
"NIB","Nikolai, AK: Nikolai Airport","Nikolai, AK","Alaska",
"IKO","Nikolski, AK: Nikolski Afs","Nikolski, AK","Alaska",
"RQI","Nixon Fork Mine, AK: Nixon Fork Mine Airport","Nixon Fork Mine, AK","Alaska",
"WTK","Noatak, AK: Noatak Airport","Noatak, AK","Alaska",
"OME","Nome, AK: Nome Airport","Nome, AK","Alaska",
"NNL","Nondalton, AK: Nondalton Airport","Nondalton, AK","Alaska",
"ORV","Noorvik, AK: Robert Curtis Memorial","Noorvik, AK","Alaska",
"OHC","Northeast Cape, AK: Northeast Cape Afs","Northeast Cape, AK","Alaska",
"ORT","Northway, AK: Northway Airport","Northway, AK","Alaska",
"NUI","Nuiqsut, AK: Nuiqsut Airport","Nuiqsut, AK","Alaska",
"NUL","Nulato, AK: Nulato Airport","Nulato, AK","Alaska",
"NUP","Nunapitchuk, AK: Nunapitchuk Airport","Nunapitchuk, AK","Alaska",
"XWT","Nushagak Bay, AK: Nushagak Bay Airport","Nushagak Bay, AK","Alaska",
"OLH","Old Harbor, AK: Old Harbor Airport","Old Harbor, AK","Alaska",
"KOY","Olga Bay, AK: Olga Bay Sea Plane Base","Olga Bay, AK","Alaska",
"RHI","Rhinelander, WI: Rhinelander/Oneida County","Rhinelander, WI","Wisconsin",
"MFI","Marshfield, WI: Marshfield Municipal","Marshfield, WI","Wisconsin",
"AUW","Wausau/Marshfield, WI: Wausau Municipal","Wausau/Marshfield, WI","Wisconsin",
"CWA","Wausau/Marshfield, WI: Central Wisconsin","Wausau/Marshfield, WI","Wisconsin",
"STE","Wausau/Marshfield, WI: Stevens Point","Wausau/Marshfield, WI","Wisconsin",
"ISW","Wausau/Marshfield, WI: Wisconsin Rapids","Wausau/Marshfield, WI","Wisconsin",
"MFI","Marshfield, WI: Marshfield","Marshfield, WI","Wisconsin",
"LSE","La Crosse Wis./Winona, WI: La Crosse","La Crosse Wis./Winona, WI","Wisconsin",
"MTW","Manitowoc, WI: Manitowoc Airport","Manitowoc, WI","Wisconsin",
"/MT","Manitowoc/Sheboygan, WI: Manitowoc/Sheboyan","Manitowoc/Sheboygan, WI","Wisconsin",
"/SH","Oshkosh/Appleton, WI: /Sh Oshkosh/Appleton","Oshkosh/Appleton, WI","Wisconsin",
"OSH","Oshkosh, WI: Wittman Field","Oshkosh, WI","Wisconsin",
"PRI","Prairie Du Chien, WI: Prairie Du Chien Municipal","Prairie Du Chien, WI","Wisconsin",
"RIE","Rice Lake, WI: Rice Lake Airport","Rice Lake, WI","Wisconsin",
"SBM","Sheboygan, WI: Sheboygan Memorial","Sheboygan, WI","Wisconsin",
"SUE","Sturgeon Bay, WI: Sturgeon Bay","Sturgeon Bay, WI","Wisconsin",
"UES","Waukesha, WI: Waukesha County","Waukesha, WI","Wisconsin",
"/AU","Wausau/Stevens Point, WI: Stevens Point Municipal","Wausau/Stevens Point, WI","Wisconsin",
"ISW","Wisconsin Rapids, WI: Alexander Field","Wisconsin Rapids, WI","Wisconsin",
"ANB","Anniston, AL: Anniston/Calhoun County","Anniston, AL","Alabama",
"AUO","Auburn, AL: Auburn/Opelika","Auburn, AL","Alabama",
"BHM","Birmingham, AL: Birmingham Municipal","Birmingham, AL","Alabama",
"VZI","Brundidge, AL: Brundidge Municipal","Brundidge, AL","Alabama",
"DCU","Decatur, AL: Pryor Field","Decatur, AL","Alabama",
"DHN","Dothan, AL: Dothan Regional","Dothan, AL","Alabama",
"EUF","Eufaula, AL: Weedon Field","Eufaula, AL","Alabama",
"JZW","Evergreen, AL: Middleton Field","Evergreen, AL","Alabama",
"MSL","Muscle Shoals, AL: Northwest Alabama Regional","Muscle Shoals, AL","Alabama",
"GAD","Gadsden, AL: Gadsen Municipal","Gadsden, AL","Alabama",
"VWA","Headland, AL: Headland Municipal","Headland, AL","Alabama",
"HSV","Huntsville, AL: Huntsville International  Carl Jones","Huntsville, AL","Alabama",
"HUA","Huntsville, AL: Redstone Army Air Field","Huntsville, AL","Alabama",
"XWU","Marion, AL: Perry County","Marion, AL","Alabama",
"MOB","Mobile, AL: Mobile Regional","Mobile, AL","Alabama",
"BFM","Mobile, AL: Mobile Aerospace","Mobile, AL","Alabama",
"MXF","Montgomery, AL: Maxwell Air Force Base","Montgomery, AL","Alabama",
"MGM","Montgomery, AL: Dannelly Field","Montgomery, AL","Alabama",
"OZR","Ozark, AL: Cairns Army Air Field","Ozark, AL","Alabama",
"SEM","Selma, AL: Craig Field","Selma, AL","Alabama",
"SEM","Selma, AL: Craig Air Force Base","Selma, AL","Alabama",
"SES","Selma, AL: Selfield","Selma, AL","Alabama",
"ASN","Talladega, AL: Talladega Municipal","Talladega, AL","Alabama",
"TCL","Tuscaloosa, AL: Tuscaloosa Municipal","Tuscaloosa, AL","Alabama",
"MOB","Bates Field, AL: Bates Field Airport","Bates Field, AL","Alabama",
"ETS","Enterprise, AL: Enterprise Municipal","Enterprise, AL","Alabama",
"/HV","Huntsville, AL: (Huntsville Mean)","Huntsville, AL","Alabama",
"/MA","Mobile, AL: Mobile/Pascagoula","Mobile, AL","Alabama",
"/MV","Montgomery, AL: Montgomery Airport","Montgomery, AL","Alabama",
"/EM","Selma, AL: (Selma Mean)","Selma, AL","Alabama",
"TGE","Tuskegee, AL: Sharpe Field","Tuskegee, AL","Alabama",
"BWG","Bowling Green, KY: Bowling Green/Warren County","Bowling Green, KY","Kentucky",
"WQN","Campbellsville, KY: Taylor County","Campbellsville, KY","Kentucky",
"EKX","Elizabethtown, KY: Addington Field","Elizabethtown, KY","Kentucky",
"FFT","Frankfort, KY: Capital City","Frankfort, KY","Kentucky",
"DQP","Georgetown, KY: Marshall Field","Georgetown, KY","Kentucky",
"HOP","Hopkinsville, KY: Campbell Army Air Field","Hopkinsville, KY","Kentucky",
"LOZ","London/Corbin, KY: Roscoe E Magee Memorial","London/Corbin, KY","Kentucky",
"SDF","Louisville, KY: Standiford Field","Louisville, KY","Kentucky",
"LOU","Louisville, KY: Bowman Field","Louisville, KY","Kentucky",
"PHL","Philadelphia, PA: Philadelphia International","Philadelphia, PA","Pennsylvania",
"PNE","Philadelphia, PA: Northeast","Philadelphia, PA","Pennsylvania",
"AGC","Pittsburgh, PA: Allegheny County","Pittsburgh, PA","Pennsylvania",
"CVA","Pittsburgh, PA: Civic Arena H/P","Pittsburgh, PA","Pennsylvania",
"RDG","Reading, PA: Reading Municipal Gen C A Spaatz","Reading, PA","Pennsylvania",
"RED","Reedsville, PA: Mifflin County","Reedsville, PA","Pennsylvania",
"AVP","Scranton/Wilkes-Barre, PA: Wilkes Barre Scranton","Scranton/Wilkes-Barre, PA","Pennsylvania",
"STQ","St. Mary's, PA: St Marys Municipal","St. Mary's, PA","Pennsylvania",
"IPT","Williamsport, PA: Williamsport Regional","Williamsport, PA","Pennsylvania",
"NXX","Willow Grove, PA: Willow Grove Nas","Willow Grove, PA","Pennsylvania",
"WKV","Philadelphia, PA: Penns Landing Seaplane Base","Philadelphia, PA","Pennsylvania",
"PNE","Philadelphia, PA: North Philadelphia","Philadelphia, PA","Pennsylvania",
"BBX","Blue Bell, PA: Wings Field","Blue Bell, PA","Pennsylvania",
"/PS","Clearfld/Philisbg/Bellefnte, PA: /Ps Clfld/Phlpsbg/Blfnt","Clearfld/Philisbg/Bellefnte, PA","Pennsylvania",
"/MD","Harrisburg/York, PA: Harrisburg International  Olmsted Field","Harrisburg/York, PA","Pennsylvania",
"LBE","Latrobe, PA: Latrobe","Latrobe, PA","Pennsylvania",
"/PH","Philadelphia, PA: /Ph Philadelphia/Camden","Philadelphia, PA","Pennsylvania",
"/PH","Philadelphia, PA: Philadelphia Airport","Philadelphia, PA","Pennsylvania",
"/PU","Pittsburgh, PA: Pittsburgh","Pittsburgh, PA","Pennsylvania",
"/PU","Pittsburgh, PA: Pittsburgh","Pittsburgh, PA","Pennsylvania",
"DOV","Dover, DE: Dover Air Force Base","Dover, DE","Delaware",
"GED","Georgetown, DE: Sussex County","Georgetown, DE","Delaware",
"ILG","Wilmington, DE: Greater Wilmington","Wilmington, DE","Delaware",
"REH","Rehoboth, DE: Rehoboth Aircrafters","Rehoboth, DE","Delaware",
"DVX","Dover, DE: Delaware Airpark","Dover, DE","Delaware",
"IAD","Washington, DC: Dulles International","Washington, DC","District of Columbia",
"DCA","Washington, DC: Ronald Reagan Washington National","Washington, DC","District of Columbia",
"WAS","Washington, DC: Washington Airport","Washington, DC","District of Columbia",
"BZS","Washington Dc, DC: Buzzards Point Sea Plane Base","Washington Dc, DC","District of Columbia",
"WAS","Washington, DC: Washington Metropolitan Area","Washington, DC","District of Columbia",
"/WS","Washington, DC: /Ws Washington","Washington, DC","District of Columbia",
"/WS","Washington, DC: Washington Airport","Washington, DC","District of Columbia",
"AVO","Avon Park, FL: Avon Park Municipal","Avon Park, FL","Florida",
"JZQ","Brooksville, FL: Hernando County","Brooksville, FL","Florida",
"COF","Cocoa Beach, FL: Patrick Air Force Base","Cocoa Beach, FL","Florida",
"CEW","Crestview, FL: Bob Sikes","Crestview, FL","Florida",
"CTY","Cross City, FL: Cross City Airport","Cross City, FL","Florida",
"DAB","Daytona Beach, FL: Daytona Beach Regional","Daytona Beach, FL","Florida",
"DSI","Destin, FL: Destin Fort Walton Beach","Destin, FL","Florida",
"FLL","Fort Lauderdale, FL: Fort Lauderdale Hwd International","Fort Lauderdale, FL","Florida",
"FLL","Fort Lauderdale, FL: Fort Lauderdale International","Fort Lauderdale, FL","Florida",
"FXE","Fort Lauderdale, FL: Fort Lauderdale Executive","Fort Lauderdale, FL","Florida",
"FMY","Fort Myers, FL: Page Field","Fort Myers, FL","Florida",
"FPR","Fort Pierce, FL: St Lucie County International","Fort Pierce, FL","Florida",
"RSW","Ft. Myers, FL: Southwest Florida International Airport","Fort Myers, FL","Florida",
"GNV","Gainesville, FL: Gainesville Regional","Gainesville, FL","Florida",
"HST","Homestead, FL: Homestead Air Force Base","Homestead, FL","Florida",
"JAX","Jacksonville, FL: Jacksonville International","Jacksonville, FL","Florida",
"NIP","Jacksonville, FL: Jacksonville Nas","Jacksonville, FL","Florida",
"NZC","Jacksonville, FL: Cecil Field","Jacksonville, FL","Florida",
"XWN","Jupiter, FL: William P Gwinn","Jupiter, FL","Florida",
"EYW","Key West, FL: Key West International","Key West, FL","Florida",
"NQX","Key West, FL: Key West Naval Air Station","Key West, FL","Florida",
"XXW","Lake City, FL: Lake City Municipal","Lake City, FL","Florida",
