"AIRPORT","TR_AIRPORT_NAME","TR_CITY_NAME","TR_STATE_NAME",
"MSQ","Minsk, U.S.S.R. (European): Minsk Airport","Minsk, U.S.S.R. (European)","",
"DME","Moscow, U.S.S.R. (European): Domodedovo","Moscow, U.S.S.R. (European)","",
"SVO","Moscow, U.S.S.R. (European): Sheremetyevo","Moscow, U.S.S.R. (European)","",
"VKO","Moscow, U.S.S.R. (European): Vnukovo","Moscow, U.S.S.R. (European)","",
"MOW","Moscow, U.S.S.R. (European): Metropolitan Area","Moscow, U.S.S.R. (European)","",
"ODS","Odessa, U.S.S.R. (European): Odessa Central","Odessa, U.S.S.R. (European)","",
"RIX","Riga, U.S.S.R. (European): Riga Airport","Riga, U.S.S.R. (European)","",
"ROV","Rostov, U.S.S.R. (European): Rostov Airport","Rostov, U.S.S.R. (European)","",
"SIP","Simferopol, U.S.S.R. (European): Simferopol Airport","Simferopol, U.S.S.R. (European)","",
"LED","St. Petersburg, U.S.S.R. (European): Pulkovo","St. Petersburg, U.S.S.R. (European)","",
"SUI","Sukhumi, U.S.S.R. (European): Babusheri","Sukhumi, U.S.S.R. (European)","",
"TLL","Tallinn, U.S.S.R. (European): Ulemiste","Tallinn, U.S.S.R. (European)","",
"TBS","Tbilisi, U.S.S.R. (European): Novo Alexeyevka","Tbilisi, U.S.S.R. (European)","",
"VNO","Vilnius, U.S.S.R. (European): Vilnius Airport","Vilnius, U.S.S.R. (European)","",
"VOG","Volgograd, U.S.S.R. (European): Volgograd Airport","Volgograd, U.S.S.R. (European)","",
"OZH","Zaporozh'ye, U.S.S.R. (European): Zaporozh'ye Airport","Zaporozh'ye, U.S.S.R. (European)","",
"RSC","Skulte, U.S.S.R. (European): Skulte","Skulte Airport, U.S.S.R. (European)","",
"RIX","Spilve, U.S.S.R. (European): Spilve","Spilve Airport, U.S.S.R. (European)","",
"ARH","Arkhangel'sk, U.S.S.R. (European): Arkhangel'sk Airport","Arkhangel'sk, U.S.S.R. (European)","",
"/IE","Kiev, U.S.S.R. (European): (Kiev Mean)","Kiev, U.S.S.R. (European)","",
"/IE","Kiev, U.S.S.R. (European): (Kiev Mean)","Kiev, U.S.S.R. (European)","",
"/MS","Moscow, U.S.S.R. (European): (Moscow Mean)","Moscow, U.S.S.R. (European)","",
"MMK","Murmansk, U.S.S.R. (European): Murmansk Airport","Murmansk, U.S.S.R. (European)","",
"/RX","Riga, U.S.S.R. (European): (Riga Mean)","Riga, U.S.S.R. (European)","",
"STW","Stavropol, U.S.S.R. (European): Stavropol Airport","Stavropol, U.S.S.R. (European)","",
"ULY","Ulyanovsk, U.S.S.R. (European): Ulyanovsk Airport","Ulyanovsk, U.S.S.R. (European)","",
"YKM","Yakima, WA: Yakima Air Terminal","Yakima, WA","Washington",
"LRN","Larson Air Force Base , WA: Larson Air Force Base Airport","Larson Afb, WA","Washington",
"LKE","Seattle, WA: Lake Union Sea Plane Base","Seattle, WA","Washington",
"SEA","Seattle/Tacoma International , WA: Seattle","Seattle/Tacoma Intl. Airport, WA","Washington",
"BYW","Blakely Island, WA: Blakely Island Airport","Blakely Island, WA","Washington",
"QQA","Center Island, WA: Center Island Airport","Center Island, WA","Washington",
"CLS","Chehalis, WA: Chehalis Centralia","Chehalis, WA","Washington",
"XXV","Decatur Shores, WA: Decatur Shores Airport","Decatur Shores, WA","Washington",
"/ES","Eastsound, WA: Eastsound Airport","Eastsound, WA","Washington",
"WUQ","Ocean Shores, WA: Avco","Ocean Shores, WA","Washington",
"MWH","Moses Lake, WA: Grant County","Moses Lake, WA","Washington",
"/MG","Moses Lake, WA: (Moses Lake Mean)","Moses Lake, WA","Washington",
"/SE","Seattle, WA: /Seattle Washington","Seattle, WA","Washington",
"/SE","Seattle, WA: Seattle Tacoma","Seattle, WA","Washington",
"/SE","Seattle/Tacoma, WA: Seattle/Ta","Seattle/Tacoma, WA","Washington",
"/SE","Seattle/Tacoma, WA: Seattle/Tacoma Airport","Seattle/Tacoma, WA","Washington",
"SHN","Shelton, WA: Sanderson Field","Shelton, WA","Washington",
"/SK","Spokane, WA: (Spokane Mean)","Spokane, WA","Washington",
"SSW","Stuart Island, WA: Stuart Island Airpark","Stuart Island, WA","Washington",
"/TM","Tacoma, WA: (Tacoma Mean)","Tacoma, WA","Washington",
"BZE","Belize City, Belize: Phillip S.W. Goldson International","Belize City, Belize","",
"CYC","Caye Chapel, Belize: Caye Chapel Airport","Caye Chapel, Belize","",
"TZF","Maya Beach, Belize: Maya Beach Airport","Maya Beach, Belize","",
"TGY","Punta Gorda, Belize: Punta Gorda Airport","Punta Gorda, Belize","",
"TZA","Belize City, Belize: Belize City Municipal","Belize City, Belize","",
"/BZ","Belize City, Belize: Belize City","Belize City, Belize","",
"/BZ","Belize, Belize: Belize City Municipal","Belize, Belize","",
"CZH","Corozal, Belize: Corozal  B.H.","Corozal, Belize","",
"CZH","Corozal, Belize: Corozal Municipal","Corozal, Belize","",
"WXD","Melinda, Belize: Melinda Airport","Melinda, Belize","",
"MDB","Melinda, Belize: Melinda Br Honduras","Melinda, Belize","",
"MDB","Melinda, Belize: Melinda Airport","Melinda, Belize","",
"PND","Punta Gorda, Belize: Punta Gorda Airport","Punta Gorda, Belize","",
"PND","Punta Gorda, Belize: Punta Gordo","Punta Gorda, Belize","",
"WRK","San Pedro, Belize: San Pedro","San Pedro, Belize","",
"SPR","San Pedro, Belize: San Pedro Airport","San Pedro, Belize","",
"SPR","San Pedro, Belize: San Pedro Br Hond","San Pedro, Belize","",
"BCL","Barra Colorado, Costa Rica: Barra Del Colorado","Barra Colorado, Costa Rica","",
"OTR","Coto 47, Costa Rica: Coto 47 Airport","Coto 47, Costa Rica","",
"GLF","Golfito, Costa Rica: Golfito 1","Golfito, Costa Rica","",
"LIR","Liberia, Costa Rica: Liberia Airport","Liberia, Costa Rica","",
"LIO","Limon, Costa Rica: Puerto Limon","Limon, Costa Rica","",
"NCT","Nicoya, Costa Rica: Nicoya Airport","Nicoya, Costa Rica","",
"PMZ","Palmar, Costa Rica: Palmar Sur 1","Palmar, Costa Rica","",
"XQP","Quepos, Costa Rica: Quepos Managua","Quepos, Costa Rica","",
"SJO","San Jose, Costa Rica: Santamaria International","San Jose, Costa Rica","",
"SZC","Santa Cruz, Costa Rica: Santa Cruz Airport","Santa Cruz, Costa Rica","",
"LCS","Las Canas, Costa Rica: Las Canas","Las Canas, Costa Rica","",
"PJM","Puerto Jimenez, Costa Rica: Puerto Jimenez Airport","Puerto Jimenez, Costa Rica","",
"SAL","San Salvador, El Salvador: Ilopango","San Salvador, El Salvador","",
"CBV","Coban, Guatemala: Coban Airport","Coban, Guatemala","",
"FRS","Flores, Guatemala: Flores Airport","Flores, Guatemala","",
"GUA","Guatemala City, Guatemala: La Aurora","Guatemala City, Guatemala","",
"TKM","Tikal, Guatemala: Tikal Airport","Tikal, Guatemala","",
"CMM","Carmelita, Guatemala: Carmelita Airport","Carmelita, Guatemala","",
"MCR","Melchor De Mencos, Guatemala: Melchor De Mencos Airport","Melchor De Mencos, Guatemala","",
"PCG","Paso Caballos, Guatemala: Paso Caballos Airport","Paso Caballos, Guatemala","",
"NVA","Neiva, Colombia: La Manguita","Neiva, Colombia","",
"IVA","Ambanja, Madagascar: Ambanja","Ambanja, Madagascar","",
"IVA","Ambanja, Madagascar: Ambanja/Ambalavelona","Ambanja, Madagascar","",
"AMP","Ampanihy, Madagascar: Ampanihy Airport","Ampanihy, Madagascar","",
"HVA","Avalalava, Madagascar: Avalalava Airport","Avalalava, Madagascar","",
"OVA","Bekily, Madagascar: Bekily Airport","Bekily, Madagascar","",
"BMD","Belo, Madagascar: Belo","Belo, Madagascar","",
"BMD","Belo, Madagascar: Belo Sur Tsiribihina","Belo, Madagascar","",
"BKU","Betioky, Madagascar: Betioky Airport","Betioky, Madagascar","",
"RVA","Farafangana, Madagascar: Farafangana Airport","Farafangana, Madagascar","",
"FTU","Fort Dauphin, Madagascar: Marillac","Fort Dauphin, Madagascar","",
"MXT","Maintirano, Madagascar: Maintirano Airport","Maintirano, Madagascar","",
"MXT","Maintirano, Madagascar: Maintirano Airport","Maintirano, Madagascar","",
"MJN","Majunga, Madagascar: Majunga/Amborovy","Majunga, Madagascar","",
"WVK","Manakara, Madagascar: Manakara Sud","Manakara, Madagascar","",
"WMR","Mananara, Madagascar: Mananara Airport","Mananara, Madagascar","",
"WMR","Mananara, Madagascar: Mananara Airport","Mananara, Madagascar","",
"MJA","Manja, Madagascar: Manja Airport","Manja, Madagascar","",
"ZVA","Miandrivazo, Madagascar: Miandrivazo Airport","Miandrivazo, Madagascar","",
"TVA","Morafenobe, Madagascar: Morafenobe Airport","Morafenobe, Madagascar","",
"MOQ","Morondava, Madagascar: Morondava Airport","Morondava, Madagascar","",
"NOS","Nossi-Be, Madagascar: Fascene","Nossi-Be, Madagascar","",
"SVB","Sambava, Madagascar: Sambava Airport","Sambava, Madagascar","",
"TMM","Tamatave, Madagascar: Tamatave Airport","Tamatave, Madagascar","",
"TNR","Tananarive, Madagascar: Tananarive","Tananarive, Madagascar","",
"TNR","Tananarive, Madagascar: Tananarive Airport","Tananarive, Madagascar","",
"TTS","Tsaratanana, Madagascar: Tsaratanana Airport","Tsaratanana, Madagascar","",
"WTS","Tsiroanomandidy, Madagascar: Tsiroanomandidy Airport","Tsiroanomandidy, Madagascar","",
"WTS","Tsiroanomandidy, Madagascar: Tsiroanomandidy Airport","Tsiroanomandidy, Madagascar","",
"TLE","Tulear, Madagascar: Tulear Airport","Tulear, Madagascar","",
"BLZ","Blantyre, Malawi: Chileka International","Blantyre, Malawi","",
"KGJ","Karonga, Malawi: Karonga Airport","Karonga, Malawi","",
"LLW","Lilongwe, Malawi: Lilongwe International","Lilongwe, Malawi","",
"MAI","Mangochi, Malawi: Mangochi Airport","Mangochi, Malawi","",
"ZZU","Mzuzu, Malawi: Mzuzu Airport","Mzuzu, Malawi","",
"ZOM","Zomba, Malawi: Zomba Airport","Zomba, Malawi","",
"BKO","Bamako, Mali: Bamako Airport","Bamako, Mali","",
"GAQ","Gao, Mali: Gao Airport","Gao, Mali","",
"GUD","Goundam, Mali: Goundam Airport","Goundam, Mali","",
"KYS","Kayes, Mali: Kayes Airport","Kayes, Mali","",
"MZI","Mopti, Mali: Mopti Airport","Mopti, Mali","",
"NIX","Nioro, Mali: Nioro Airport","Nioro, Mali","",
"TOM","Tombouctou, Mali: Tombouctou Airport","Tombouctou, Mali","",
"KNI","Kenieba, Mali: Kenieba","Kenieba, Mali","",
"KNZ","Kenieba, Mali: Kenieba Mali","Kenieba, Mali","",
"AEO","Aioun El Atrouss, Mauritania: Aioun El Atrouss Airport","Aioun El Atrouss, Mauritania","",
"AJJ","Akjoujt, Mauritania: Akjoujt Airport","Akjoujt, Mauritania","",
"LEG","Aleg, Mauritania: Aleg Airport","Aleg, Mauritania","",
"FGD","Fderick, Mauritania: Fderick Airport","Fderick, Mauritania","",
"KED","Kaedi, Mauritania: Kaedi Airport","Kaedi, Mauritania","",
"KFA","Kiffa, Mauritania: Kiffa Airport","Kiffa, Mauritania","",
"MOM","Moudjeria, Mauritania: Moudjeria Ledfotar","Moudjeria, Mauritania","",
"EMN","Nema, Mauritania: Nema Airport","Nema, Mauritania","",
"NKC","Nouakchott, Mauritania: Nouakchott Airport","Nouakchott, Mauritania","",
"TMD","Timbedra, Mauritania: Timbedra Airport","Timbedra, Mauritania","",
"ATR","Atar, Mauritania: Atar Airport","Atar, Mauritania","",
"BIP","Bir Moghreim, Mauritania: Bir Moghreim","Bir Moghreim, Mauritania","",
"WIF","Bir Moghreim, Mauritania: Bir Moghreim","Bir Moghreim, Mauritania","",
"WDT","F'derick, Mauritania: F'derick","F'derick, Mauritania","",
"FGD","F, Mauritania: F Airport","F, Mauritania","",
"NDB","Nouadhibou, Mauritania: Nouadhibou","Nouadhibou, Mauritania","",
"SEY","Selibaby, Mauritania: Selibabi","Selibaby, Mauritania","",
"TUK","Turbat, Pakistan: Turbat Airport","Turbat, Pakistan","",
"APR","Aparri, Philippines: Aparri Airport","Aparri, Philippines","",
"BCD","Bacolod, Philippines: Bacolod Airport","Bacolod, Philippines","",
"BAG","Baguio, Philippines: Baguio Airport","Baguio, Philippines","",
"BSO","Basco, Philippines: Basco","Basco, Philippines","",
"BXU","Butuan, Philippines: Bancasi","Butuan, Philippines","",
"CGY","Cagayan, Philippines: Cagayan De Oro","Cagayan, Philippines","",
"CYP","Calbayog, Philippines: Calbayog Airport","Calbayog, Philippines","",
"CGM","Camiguin, Philippines: Camiguin Airport","Camiguin, Philippines","",
"CYZ","Cauayan, Philippines: Cauayan Airport","Cauayan, Philippines","",
"CEB","Cebu, Philippines: Cebu Airport","Cebu, Philippines","",
"CBO","Cotabato, Philippines: Cotabato Airport","Cotabato, Philippines","",
"DAE","Daet, Philippines: Daet Airport","Daet, Philippines","",
"DVO","Davao, Philippines: Davao Airport","Davao, Philippines","",
"DPL","Dipolog, Philippines: Dipolog Airport","Dipolog, Philippines","",
"DGT","Dumaguete, Philippines: Dumaguete Airport","Dumaguete, Philippines","",
"GES","General Santos, Philippines: General Santos Airport","General Santos, Philippines","",
"IGN","Iligan, Philippines: Maria Cristina","Iligan, Philippines","",
"ILO","Iloilo, Philippines: Iloilo Airport","Iloilo, Philippines","",
"IPE","Ipil, Philippines: Ipil Airport","Ipil, Philippines","",
"JOL","Jolo, Philippines: Jolo Airport","Jolo, Philippines","",
"KLO","Kalibo, Philippines: Kalibo Airport","Kalibo, Philippines","",
"LAO","Laoag, Philippines: Laoag Airport","Laoag, Philippines","",
"LGP","Legaspi, Philippines: Legaspi Airport","Legaspi, Philippines","",
"LBX","Lubang, Philippines: Lubang Airport","Lubang, Philippines","",
"CRK","Luzon Island, Philippines: Clark Ab","Luzon Island, Philippines","",
"NCP","Luzon Island, Philippines: Cubi Point Nas","Luzon Island, Philippines","",
"NOP","Mactan Island, Philippines: Mactan International","Mactan Island, Philippines","",
"MNL","Manila, Philippines: Manila International","Manila, Philippines","",
"MBT","Masbate, Philippines: Masbate Airport","Masbate, Philippines","",
"WNP","Naga, Philippines: Naga Airport","Naga, Philippines","",
"OZC","Ozamis City, Philippines: Misamis","Ozamis City, Philippines","",
"PPS","Puerto Princesa, Philippines: Puerto Princesa Airport","Puerto Princesa, Philippines","",
"RXS","Roxas City, Philippines: Roxas","Roxas City, Philippines","",
"SJI","San Jose, Philippines: San Jose Airport","San Jose, Philippines","",
"SFS","Subic Bay, Philippines: Subic Bay International","Subic Bay, Philippines","",
"SUG","Surigao, Philippines: Surigao Airport","Surigao, Philippines","",
"TAC","Tacloban, Philippines: Tacloban Sea Plane Base","Tacloban, Philippines","",
"TAG","Tagbilaran, Philippines: Tagbilaran Airport","Tagbilaran, Philippines","",
"ZAM","Zamboanga, Philippines: Zamboanga Airport","Zamboanga, Philippines","",
"BGN","Bagabag, Philippines: Bagabag","Bagabag, Philippines","",
"BQA","Baler, Philippines: Baler Airport","Baler, Philippines","",
"BPH","Bislig, Philippines: Bislig Airport","Bislig, Philippines","",
"/LZ","Luzon Island, Philippines: (Luzon Island Mean)","Luzon Island, Philippines","",
"MLP","Malabang, Philippines: Malabang","Malabang, Philippines","",
"MBO","Mamburao, Philippines: Mamburao","Mamburao, Philippines","",
"MRQ","Marinduque, Philippines: Marinduque Airport","Marinduque, Philippines","",
"PAG","Pagadian, Philippines: Pagadian Airport","Pagadian, Philippines","",
"SGL","Sangley Point, Philippines: Sangley Point Ab","Sangley Point, Philippines","",
"TUG","Tuguegarao, Philippines: Tuguegarao","Tuguegarao, Philippines","",
"VRC","Virac, Philippines: Virac Airport","Virac, Philippines","",
"DYR","Anadyr, Russia (Asian): Ugolnyye Kopi","Anadyr, Russia (Asian)","",
"BQS","Blagoveschensk, Russia (Asian): Ignatyevo","Blagoveschensk, Russia (Asian)","",
"BTK","Bratsk, Russia (Asian): Bratsk Airport","Bratsk, Russia (Asian)","",
"SVX","Ekaterinburg, Russia (Asian): Koltsovo","Ekaterinburg, Russia (Asian)","",
"IKT","Irkutsk, Russia (Asian): Irkutsk Airport","Irkutsk, Russia (Asian)","",
"KHV","Khabarovsk, Russia (Asian): Novyy","Khabarovsk, Russia (Asian)","",
"KJA","Krasnojarsk, Russia (Asian): Krasnojarsk Airport","Krasnojarsk, Russia (Asian)","",
"MYF","San Diego, CA: Montgomery Field","San Diego, CA","California",
"SAN","San Diego, CA: San Diego International","San Diego, CA","California",
"SAN","San Diego, CA: San Diego International  Lindbergh Fl","San Diego, CA","California",
"SEE","San Diego, CA: Gillespie Field","San Diego, CA","California",
"SDM","San Diego, CA: Brown Field Municipal","San Diego, CA","California",
"SFO","San Francisco, CA: San Francisco International","San Francisco, CA","California",
"JMC","San Francisco, CA: Marin County Heliport","San Francisco, CA","California",
"JCC","San Francisco, CA: China Basin Heliport","San Francisco, CA","California",
"PAO","Palo Alto, CA: Palo Alto Of Santa","Palo Alto, CA","California",
"PRB","San Luis Obispo/Paso Robls, CA: Paso Robles Municipal","San Luis Obispo/Paso Robls, CA","California",
"SBP","San Luis Obispo/Paso Robles, CA: San Luis Obispo/Paso Robles Airport","San Luis Obispo/Paso Robles, CA","California",
"QQP","Sanger, CA: Wonder Valley","Sanger, CA","California",
"NZJ","Santa Ana, CA: El Toro Mcas","Santa Ana, CA","California",
"JOC","Santa Ana, CA: Centerport Heliport","Santa Ana, CA","California",
"SNA","Santa Ana, CA: John Wayne Orange County","Santa Ana, CA","California",
"SBA","Santa Barbara, CA: Santa Barbara Municipal","Santa Barbara, CA","California",
"SMX","Santa Maria, CA: Santa Maria Public","Santa Maria, CA","California",
"SZP","Santa Paula, CA: Santa Paula Airport","Santa Paula, CA","California",
"STS","Santa Rosa, CA: Sonoma County","Santa Rosa, CA","California",
"QQW","Santa Rosa, CA: Santa Rosa Air Center","Santa Rosa, CA","California",
"ZXQ","Santa Ynez, CA: Santa Ynez Airport","Santa Ynez, CA","California",
"SQA","Santa Ynez, CA: Santa Ynez Airport","Santa Ynez, CA","California",
"QQM","Shingletown, CA: Shingletown Airport","Shingletown, CA","California",
"SCK","Stockton, CA: Stockton Metropolitan","Stockton, CA","California",
"TSP","Tehachapi, CA: Tehachapi Kern County Nr 4","Tehachapi, CA","California",
"TRM","Thermal, CA: Thermal Airport","Thermal, CA","California",
"TKF","Truckee, CA: Truckee Tahoe","Truckee, CA","California",
"TLR","Tulare, CA: Mefford Field","Tulare, CA","California",
"WQD","Tulelake, CA: Tulelake Municipal","Tulelake, CA","California",
"TNP","Twentynine Palms, CA: Twentynine Palms Airport","Twentynine Palms, CA","California",
"TWH","Two Harbors, CA: Two Harbors- Tw","Two Harbors, CA","California",
"UKI","Ukiah, CA: Ukiah Municipal","Ukiah, CA","California",
"VCV","Victorville, CA: George Air Force Base","Victorville, CA","California",
"VIS","Visalia, CA: Visalia Municipal","Visalia, CA","California",
"RQU","Wasco, CA: Wasco-Kern County","Wasco, CA","California",
"WVI","Watsonville, CA: Watsonville Municipal","Watsonville, CA","California",
"VWM","Weed, CA: Weed Airport","Weed, CA","California",
"XXN","Willits, CA: Ells Field-Willits Municipal","Willits, CA","California",
"QQN","Woodlake, CA: Woodlake Airport","Woodlake, CA","California",
"RQQ","Woodland, CA: Watts/Woodland","Woodland, CA","California",
"CIB","Catalina Island, CA: In The Sky","Catalina Island, CA","California",
"TWH","Two Harbors, CA: Two Harbors Airport","Two Harbors, CA","California",
"WJF","Lancaster, CA: William J Fox","Lancaster, CA","California",
"WBY","Downtown, CA: Downtown Airport","Downtown Airport, CA","California",
"JCE","Oakland Convention Center, CA: Oakland Conv. Ctr.","Oakland Convention Center, CA","California",
"SAN","International, CA: San Diego International","International Airport, CA","California",
"SMO","Santa Monica, CA: Santa Monica Airport","Santa Monica, CA","California",
"/BA","Bakersfield, CA: (Bakersfield Mean)","Bakersfield, CA","California",
"BXS","Borrego Springs, CA: Borrego Springs Airport","Borrego Springs, CA","California",
"CCR","Concord, CA: Buchanan Field","Concord, CA","California",
"/BR","Burbank, CA: Hollywood Burbank","Burbank, CA","California",
"/CT","Catalina Island, CA: Catalina Island","Catalina Island, CA","California",
"EDW","Edwards, CA: Edwards Ca","Edwards, CA","California",
"/EU","Eureka/Arcata, CA: Eureka/Arcata","Eureka/Arcata, CA","California",
"/FS","Fresno, CA: (Fresno Mean)","Fresno, CA","California",
"WJF","Lancaster, CA: Lancaster Airport","Lancaster, CA","California",
"/PD","Palmdale/Lancaster, CA: Palmdale/Lancaster Airport","Palmdale/Lancaster, CA","California",
"/LM","Lompoc, CA: (Lompoc Mean)","Lompoc, CA","California",
"OTU","Otu, Colombia: Otu Airport","Otu, Colombia","",
"PSO","Pasto, Colombia: Pasto Airport","Pasto, Colombia","",
"PZA","Paz De Ariporo, Colombia: Paz De Ariporo Airport","Paz De Ariporo, Colombia","",
"PEI","Pereira, Colombia: Matecana","Pereira, Colombia","",
"PLA","Planadas, Colombia: Planadas Airport","Planadas, Colombia","",
"PPN","Popayan, Colombia: Machangara","Popayan, Colombia","",
"PUU","Puerto Asis, Colombia: Puerto Asis Airport","Puerto Asis, Colombia","",
"PCC","Puerto Rico, Colombia: Puerto Rico Airport","Puerto Rico, Colombia","",
"UIB","Quibdo, Colombia: El Carano","Quibdo, Colombia","",
"RCH","Riohacha, Colombia: Riohacha Airport","Riohacha, Colombia","",
"ADZ","San Andres Island, Colombia: Sesquicentenario","San Andres Island, Colombia","",
"SMR","Santa Marta, Colombia: Simon Bolivar","Santa Marta, Colombia","",
"TDA","Trinidad, Colombia: San Luis De Palenque","Trinidad, Colombia","",
"ULQ","Tulua, Colombia: Farfan","Tulua, Colombia","",
"TCO","Tumaco, Colombia: La Florida","Tumaco, Colombia","",
"TRB","Turbo, Colombia: Turbo Airport","Turbo, Colombia","",
"VUP","Valledupar, Colombia: Valledupar Airport","Valledupar, Colombia","",
"VVC","Villavicencio, Colombia: Apiay","Villavicencio, Colombia","",
"BUN","Buenaventura, Colombia: Buenaventura","Buenaventura, Colombia","",
"CRC","Cartago, Colombia: Cartago Airport","Cartago, Colombia","",
"IGO","Chigorodo, Colombia: Chigorodo Airport","Chigorodo, Colombia","",
"CZD","Codazzi, Colombia: Codazzi","Codazzi, Colombia","",
"ELJ","El Recreo, Colombia: El Recreo Airport","El Recreo, Colombia","",
"GPI","Guapi, Colombia: Guapi Airport","Guapi, Colombia","",
"/HM","Medellin, Colombia: (Medellin Mean)","Medellin, Colombia","",
"MIX","Miriti, Colombia: Miriti Pirana","Miriti, Colombia","",
"ORC","Orocue, Colombia: Orocue Airport","Orocue, Colombia","",
"PTX","Pitalito, Colombia: Pitalito Airport","Pitalito, Colombia","",
"WPS","Pitalito, Colombia: Pitalito","Pitalito, Colombia","",
"PLC","Planeta Rica, Colombia: Planeta Rica Airport","Planeta Rica, Colombia","",
"PDA","Puerto Inirida, Colombia: Puerto Inirida Airport","Puerto Inirida, Colombia","",
"SMC","Santa Maria, Colombia: Santa Maria Airport","Santa Maria, Colombia","",
"SRO","Santana Ramos, Colombia: Santana Ramos Airport","Santana Ramos, Colombia","",
"CUE","Cuenca, Ecuador: Cuenca","Cuenca, Ecuador","",
"ESM","Esmeraldas, Ecuador: Gen Rivadeneira","Esmeraldas, Ecuador","",
"GPS","Galapagos Islands, Ecuador: Baltra","Galapagos Islands, Ecuador","",
"GYE","Guayaquil, Ecuador: Simon Bolivar International","Guayaquil, Ecuador","",
"LGQ","Lago Agrio, Ecuador: Lago Agrio Airport","Lago Agrio, Ecuador","",
"FVT","Latacunga, Ecuador: Latacunga Airport","Latacunga, Ecuador","",
"LOH","Loja, Ecuador: C Ponce Enriquez","Loja, Ecuador","",
"PTZ","Pastaza, Ecuador: Pastaza Airport","Pastaza, Ecuador","",
"UIO","Quito, Ecuador: Mariscal Sucre","Quito, Ecuador","",
"SCY","San Cristobal, Ecuador: San Cristobal Airport","San Cristobal, Ecuador","",
"QAG","Lago Agrio, Ecuador: Lago Agrio Airport","Lago Agrio, Ecuador","",
"MCH","Machala, Ecuador: Gen M Serrano","Machala, Ecuador","",
"MEC","Manta, Ecuador: Manta Airport","Manta, Ecuador","",
"TUA","Tulcan, Ecuador: Tulcan Airport","Tulcan, Ecuador","",
"MPN","Mount Pleasant, Falkland Islands-UK: Mount Pleasant Airport","Mount Pleasant, Falkland Islands-UK","",
"PSY","Port Stanley, Falkland Islands-UK: Stanley","Port Stanley, Falkland Islands-UK","",
"CAY","Cayenne, French Guiana-France: Rochambeau","Cayenne, French Guiana-France","",
"BMJ","Baramita, Guyana: Baramita Airport","Baramita, Guyana","",
"GEO","Georgetown, Guyana: Cheddi Jagan International","Georgetown, Guyana","",
"LTM","Lethem, Guyana: Lethem Airport","Lethem, Guyana","",
"GEO","Timehri, Guyana: Timehri In","Timehri Airport, Guyana","",
"GFO","Bartica, Guyana: Bartica Airport","Bartica, Guyana","",
"/GR","Georgetown, Guyana: Timehri International","Georgetown, Guyana","",
"KAI","Kaieteur, Guyana: Kaieteur Airport","Kaieteur, Guyana","",
"KAR","Kamarang, Guyana: Kamarang Airport","Kamarang, Guyana","",
"LTH","Lethem, Guyana: Lethem Airport","Lethem, Guyana","",
"MHA","Mahdia, Guyana: Mahdia Airport","Mahdia, Guyana","",
"ASU","Asuncion, Paraguay: Presidente Stroessner","Asuncion, Paraguay","",
"TGD","Podgorica, Serbia and Montenegro: Golubovci","Podgorica, Serbia and Montenegro","",
"MAZ","Mayaguez, Puerto Rico: Mayaguez Airport","Mayaguez, Puerto Rico","",
"PSE","Ponce, Puerto Rico: Ponce Airport","Ponce, Puerto Rico","",
"NRR","Roosevelt Roads, Puerto Rico: Roosevelt Roads Nas","Roosevelt Roads, Puerto Rico","",
"SIG","San Juan, Puerto Rico: Isla Grande","San Juan, Puerto Rico","",
"SJU","San Juan, Puerto Rico: Puerto Rico International","San Juan, Puerto Rico","",
"VQS","Vieques, Puerto Rico: Camp Garcia","Vieques, Puerto Rico","",
"HUC","Humacao, Puerto Rico: Humacao A","Humacao Airport, Puerto Rico","",
"PPD","Palmas Del Mar Air Strip, Puerto Rico: Palmas Del Mar","Palmas Del Mar Air Strip, Puerto Rico","",
"ARE","Arecibo, Puerto Rico: Arecibo","Arecibo, Puerto Rico","",
"CPX","Culebra, Puerto Rico: Culebra Airport","Culebra, Puerto Rico","",
"DDP","Dorado, Puerto Rico: Dorado Airport","Dorado, Puerto Rico","",
"WMW","Humacao, Puerto Rico: Humacao P.R.","Humacao, Puerto Rico","",
"HUC","Humacao, Puerto Rico: Humacao P.R.","Humacao, Puerto Rico","",
"/HU","Humacao, Puerto Rico: Huc/Ppd","Humacao, Puerto Rico","",
"/SU","San Juan, Puerto Rico: Puerto Rico International","San Juan, Puerto Rico","",
"CRU","Carriacou, Grenada and South Grenadines: Carriacou Airport","Carriacou, Grenada and South Grenadines","",
"GND","St.Georges, Grenada and South Grenadines: Pearls","St.Georges, Grenada and South Grenadines","",
"GND","Grenada, Grenada and South Grenadines: Grenada Airport","Grenada, Grenada and South Grenadines","",
"ANU","St. Johns, Antigua: Antigua","St. Johns, Antigua","",
"NEV","Nevis, St. Kitts and Nevis: Newcastle","Nevis, St. Kitts and Nevis","",
"SKB","St. Kitts, St. Kitts and Nevis: Golden Rock","St. Kitts, St. Kitts and Nevis","",
"SLU","St. Lucia, St. Lucia: Vigie Field","St. Lucia, St. Lucia","",
"UVF","St. Lucia, St. Lucia: Hewanorra International","St. Lucia, St. Lucia","",
"/SL","St. Lucia, St. Lucia: /Sl St. Lucia","St. Lucia, St. Lucia","",
"AUA","Aruba, Aruba: Reina Beatrix International","Aruba, Aruba","",
